### ISSUE TITLE
katran doesn't forward packets

### ISSUE THREAD

**Issue by iluffk** [facebookincubator/katran#184]
Hi. I built katran on ubuntu 22, all tests passed, but it doesn't forward (tunnel) packets:
on client side:
```
CLIENT@parallels-Parallels-Virtual-Platform:~$ telnet 10.200.200.1 22
Trying 10.200.200.1...
^C
CLIENT@parallels-Parallels-Virtual-Platform:~$ telnet 10.200.200.1 80
Trying 10.200.200.1...
telnet: Unable to connect to remote host: Connection refused
CLIENT@parallels-Parallels-Virtual-Platform:~$
```

CLIENT@parallels-Parallels-Virtual-Platform:~$ sudo tcpdump -niany
```
tcpdump: verbose output suppressed, use -v or -vv for full protocol decode
listening on any, link-type LINUX_SLL (Linux cooked v1), capture size 262144 bytes
20:19:12.388189 IP 10.211.55.7.58340 > 10.200.200.1.22: Flags [S], seq 865058872, win 64240, options [mss 1460,sackOK,TS val 2305899815 ecr 0,nop,wscale 7], length 0
20:19:34.009409 IP 10.211.55.7.41384 > 10.200.200.1.80: Flags [S], seq 407189742, win 64240, options [mss 1460,sackOK,TS val 2305921436 ecr 0,nop,wscale 7], length 0
20:19:34.009611 IP 10.200.200.1.80 > 10.211.55.7.41384: Flags [R.], seq 0, ack 407189743, win 0, length 0
20:19:39.017800 ARP, Request who-has 10.211.55.8 tell 10.211.55.7, length 28
20:19:39.018176 ARP, Reply 10.211.55.8 is-at 00:1c:42:19:ba:86, length 28
20:19:39.233773 ARP, Request who-has 10.211.55.7 tell 10.211.55.8, length 28
20:19:39.233810 ARP, Reply 10.211.55.7 is-at 00:1c:42:e9:0e:89, length 28
^C
7 packets captured
7 packets received by filter
0 packets dropped by kernel
CLIENT@parallels-Parallels-Virtual-Platform:~$
```

```
CLIENT@parallels-Parallels-Virtual-Platform:~$ ping 10.200.200.1
PING 10.200.200.1 (10.200.200.1) 56(84) bytes of data.
64 bytes from 10.200.200.1: icmp_seq=1 ttl=64 time=0.191 ms
^C
--- 10.200.200.1 ping statistics ---
1 packets transmitted, 1 received, 0% packet loss, time 0ms
rtt min/avg/max/mdev = 0.191/0.191/0.191/0.000 ms

```

so, that meant connectivity is ok.

On the server (katran) side:
I followed this manual https://github.com/facebookincubator/katran/blob/main/EXAMPLE.md

root@katran-test:/home/katran/Downloads/katran-main# ./_build/build/example_grpc/katran_server_grpc -balancer_prog ./_build/deps/bpfprog/bpf/balancer_kern.o -default_mac 00:1c:42:00:00:18 -forwarding_cores=0 -healthchecker_prog ./_build/deps/bpfprog/bpf/healthchecking_ipip.o -intf=enp0s3 -ipip_intf=ipip0 -ipip6_intf=ipip60 -lru_size=10000 -map_path /sys/fs/bpf/jmp_enp0s3 -prog_pos=2
```
I0218 19:59:02.631834 21383 KatranGrpcService.cpp:69] Starting Katran
libbpf: elf: skipping unrecognized data section(17) .eh_frame
libbpf: elf: skipping relo section(18) .rel.eh_frame for section(17) .eh_frame
libbpf: elf: skipping unrecognized data section(17) .eh_frame
libbpf: elf: skipping relo section(18) .rel.eh_frame for section(17) .eh_frame
libbpf: elf: skipping unrecognized data section(17) .eh_frame
libbpf: elf: skipping relo section(18) .rel.eh_frame for section(17) .eh_frame
libbpf: elf: skipping unrecognized data section(16) .eh_frame
libbpf: elf: skipping relo section(17) .rel.eh_frame for section(16) .eh_frame
E0218 19:59:02.710944 21383 BaseBpfAdapter.cpp:163] Error receiving netlink message: File exists [17]
Server listening on 0.0.0.0:50051
I0218 19:59:45.833081 21388 KatranLb.cpp:976] adding new vip: 10.211.55.8:22:6
I0218 20:09:50.430847 21388 KatranLb.cpp:1050] deleting vip: 10.211.55.8:22:6
I0218 20:09:59.992128 21425 KatranLb.cpp:976] adding new vip: 10.200.200.1:22:6
```

My test service:

root@katran-test:/home/katran/Downloads/katran-main# ./katran_goclient -l
```
2023/02/18 20:31:23 vips len 1
VIP:         10.200.200.1 Port:     22 Protocol: tcp
Vip's flags: 
 ->10.211.55.7       weight: 1 flags: 
exiting
```

Don't see traffic to 22 port, but there is traffic to 80 port from client (test routing and connectivity)

katran@katran-test:~/Downloads/katran-main$ sudo tcpdump -niany host 10.200.200.1 or proto 4
```
tcpdump: data link type LINUX_SLL2
tcpdump: verbose output suppressed, use -v[v]... for full protocol decode
listening on any, link-type LINUX_SLL2 (Linux cooked v2), snapshot length 262144 bytes
20:19:33.990974 enp0s3 In  IP 10.211.55.7.41384 > 10.200.200.1.80: Flags [S], seq 407189742, win 64240, options [mss 1460,sackOK,TS val 2305921436 ecr 0,nop,wscale 7], length 0
20:19:33.991000 enp0s3 Out IP 10.200.200.1.80 > 10.211.55.7.41384: Flags [R.], seq 0, ack 407189743, win 0, length 0
^C
2 packets captured
2 packets received by filter
0 packets dropped by kernel
```

katran@katran-test:~/Downloads/katran-main$ ip a
```
1: lo: <LOOPBACK,UP,LOWER_UP> mtu 65536 qdisc noqueue state UNKNOWN group default qlen 1000
    link/loopback 00:00:00:00:00:00 brd 00:00:00:00:00:00
    inet 127.0.0.1/8 scope host lo
       valid_lft forever preferred_lft forever
    inet 10.200.200.1/32 scope global lo
       valid_lft forever preferred_lft forever
    inet6 ::1/128 scope host 
       valid_lft forever preferred_lft forever
2: enp0s3: <BROADCAST,MULTICAST,UP,LOWER_UP> mtu 1500 xdp/id:53 qdisc fq_codel state UP group default qlen 1000
    link/ether 00:1c:42:19:ba:86 brd ff:ff:ff:ff:ff:ff
    altname enp0s5
    inet 10.211.55.8/24 brd 10.211.55.255 scope global dynamic noprefixroute enp0s3
       valid_lft 1655sec preferred_lft 1655sec
    inet6 fe80::82b9:1e04:6c53:89af/64 scope link noprefixroute 
       valid_lft forever preferred_lft forever
3: tunl0@NONE: <NOARP> mtu 1480 qdisc noop state DOWN group default qlen 1000
    link/ipip 0.0.0.0 brd 0.0.0.0
4: ipip0@NONE: <NOARP,UP,LOWER_UP> mtu 1480 qdisc noqueue state UNKNOWN group default qlen 1000
    link/ipip 0.0.0.0 brd 0.0.0.0
    inet 127.0.0.42/32 scope host ipip0
       valid_lft forever preferred_lft forever
5: ip6tnl0@NONE: <NOARP,UP,LOWER_UP> mtu 1452 qdisc noqueue state UNKNOWN group default qlen 1000
    link/tunnel6 :: brd :: permaddr 8edc:c4a0:5d0d::
    inet6 fe80::8cdc:c4ff:fea0:5d0d/64 scope link 
       valid_lft forever preferred_lft forever
6: ipip60@NONE: <NOARP,UP,LOWER_UP> mtu 1452 qdisc noqueue state UNKNOWN group default qlen 1000
    link/tunnel6 :: brd :: permaddr 3ad7:ec0f:e21e::
    inet6 fe80::38d7:ecff:fe0f:e21e/64 scope link 
       valid_lft forever preferred_lft forever
```
       
       
       
At the time, while i tried connect from client to katran VIP:
root@katran-test:/home/katran/Downloads/katran-main# ./katran_goclient -s -lru
```
summary: 0 pkts/sec. lru hit: 0.00% lru miss: 0.00% (tcp syn: 0.00% tcp non-syn: 0.00% udp: 0.00%) fallback lru hit: 0 pkts/sec
summary: 1 pkts/sec. lru hit: 0.00% lru miss: 100.00% (tcp syn: 1.00% tcp non-syn: 0.00% udp: 0.00%) fallback lru hit: 1 pkts/sec
summary: 0 pkts/sec. lru hit: 0.00% lru miss: 0.00% (tcp syn: 0.00% tcp non-syn: 0.00% udp: 0.00%) fallback lru hit: 0 pkts/sec
summary: 0 pkts/sec. lru hit: 0.00% lru miss: 0.00% (tcp syn: 0.00% tcp non-syn: 0.00% udp: 0.00%) fallback lru hit: 0 pkts/sec
summary: 0 pkts/sec. lru hit: 0.00% lru miss: 0.00% (tcp syn: 0.00% tcp non-syn: 0.00% udp: 0.00%) fallback lru hit: 0 pkts/sec
summary: 1 pkts/sec. lru hit: 0.00% lru miss: 100.00% (tcp syn: 1.00% tcp non-syn: 0.00% udp: 0.00%) fallback lru hit: 1 pkts/sec
summary: 2 pkts/sec. lru hit: 0.00% lru miss: 100.00% (tcp syn: 1.00% tcp non-syn: 0.00% udp: 0.00%) fallback lru hit: 2 pkts/sec
summary: 1 pkts/sec. lru hit: 0.00% lru miss: 100.00% (tcp syn: 1.00% tcp non-syn: 0.00% udp: 0.00%) fallback lru hit: 1 pkts/sec
summary: 0 pkts/sec. lru hit: 0.00% lru miss: 0.00% (tcp syn: 0.00% tcp non-syn: 0.00% udp: 0.00%) fallback lru hit: 0 pkts/sec
^C
root@katran-test:/home/katran/Downloads/katran-main# 
```

Also routing and rp_filters ok:
root@katran-test:~# sysctl -a | grep -i rp_fil
```
net.ipv4.conf.all.arp_filter = 0
net.ipv4.conf.all.rp_filter = 0
net.ipv4.conf.default.arp_filter = 0
net.ipv4.conf.default.rp_filter = 0
net.ipv4.conf.enp0s3.arp_filter = 0
net.ipv4.conf.enp0s3.rp_filter = 0
net.ipv4.conf.ip6tnl0.arp_filter = 0
net.ipv4.conf.ip6tnl0.rp_filter = 0
net.ipv4.conf.ipip0.arp_filter = 0
net.ipv4.conf.ipip0.rp_filter = 0
net.ipv4.conf.ipip60.arp_filter = 0
net.ipv4.conf.ipip60.rp_filter = 0
net.ipv4.conf.lo.arp_filter = 0
net.ipv4.conf.lo.rp_filter = 0
net.ipv4.conf.tunl0.arp_filter = 0
net.ipv4.conf.tunl0.rp_filter = 0



root@katran-test:~# sysctl -a | grep -i forwar | grep 1
net.ipv4.conf.all.forwarding = 1
net.ipv4.conf.default.forwarding = 1
net.ipv4.conf.enp0s3.forwarding = 1
net.ipv4.conf.ip6tnl0.forwarding = 1
net.ipv4.conf.ipip0.forwarding = 1
net.ipv4.conf.ipip60.forwarding = 1
net.ipv4.conf.lo.forwarding = 1
net.ipv4.conf.tunl0.forwarding = 1
net.ipv4.ip_forward = 1
```

No firewalls
root@katran-test:# iptables-save 
root@katran-test:# iptables-legacy-save 
root@katran-test:# 

root@katran-test:~# ip r 
```
default via 10.211.55.1 dev enp0s3 proto dhcp metric 100 
10.211.55.0/24 dev enp0s3 proto kernel scope link src 10.211.55.8 metric 100 
169.254.0.0/16 dev enp0s3 scope link metric 1000 
```
root@katran-test:~# ip n show
```
10.211.55.1 dev enp0s3 lladdr 00:1c:42:00:00:18 REACHABLE
10.211.55.2 dev enp0s3 lladdr 00:1c:42:00:00:08 STALE
10.211.55.7 dev enp0s3 lladdr 00:1c:42:e9:0e:89 STALE
fe80::99 dev enp0s3  FAILED
```

root@katran-test:# uname  -r
5.19.0-32-generic
root@katran-test:# cat /etc/os-release 
PRETTY_NAME="Ubuntu 22.04.1 LTS"
NAME="Ubuntu"
VERSION_ID="22.04"
VERSION="22.04.1 LTS (Jammy Jellyfish)"

Where I did mistake?

**Comment by iluffk** [comment]
No answer

**Comment by hedianxin** [comment]
hava you solved it? I meet the same problem
