### ISSUE TITLE
Reals at bridged interface

### ISSUE THREAD

**Issue by jprukner** [facebookincubator/katran#24]
Hey, I try to run Katran in a setup where more reals sit at one physical server node together with Katran.
So there are two nodes master (10.80.96.1) and test (10.80.96.3). master runs two reals(10.80.96.70, 10.80.96.68) that are part of one VIP (10.80.96.13) and test is used to create requests to the VIP.

```
root@master# ip a
1: lo: <LOOPBACK,UP,LOWER_UP> mtu 65536 qdisc noqueue state UNKNOWN group default qlen 1000
    link/loopback 00:00:00:00:00:00 brd 00:00:00:00:00:00
    inet 127.0.0.1/8 scope host lo
       valid_lft forever preferred_lft forever
    inet 10.80.96.13/32 brd 10.80.96.13 scope global lo
       valid_lft forever preferred_lft forever
    inet6 ::1/128 scope host 
       valid_lft forever preferred_lft forever
2: enp0s20f0: <BROADCAST,MULTICAST,SLAVE,UP,LOWER_UP> mtu 1500 qdisc mq master bond0 state UP group default qlen 1000
    link/ether 0c:c4:7a:e5:46:d6 brd ff:ff:ff:ff:ff:ff
3: enp0s20f1: <NO-CARRIER,BROADCAST,MULTICAST,SLAVE,UP> mtu 1500 qdisc mq master bond0 state DOWN group default qlen 1000
    link/ether 0c:c4:7a:e5:46:d7 brd ff:ff:ff:ff:ff:ff
4: bond0: <BROADCAST,MULTICAST,MASTER,UP,LOWER_UP> mtu 1500 xdpgeneric/id:142 qdisc noqueue state UP group default qlen 1000
    link/ether 0c:c4:7a:e5:46:d6 brd ff:ff:ff:ff:ff:ff
    inet 147.x.x.x/31 brd 255.255.255.255 scope global bond0
       valid_lft forever preferred_lft forever
    inet 10.80.96.1/31 brd 255.255.255.255 scope global bond0:0
       valid_lft forever preferred_lft forever
    inet6 2604:1380:2000:8f00::1/127 scope global 
       valid_lft forever preferred_lft forever
    inet6 fe80::ec4:7aff:fee5:46d6/64 scope link 
       valid_lft forever preferred_lft forever
5: docker0: <NO-CARRIER,BROADCAST,MULTICAST,UP> mtu 1500 qdisc noqueue state DOWN group default 
    link/ether 02:42:30:1c:4b:ae brd ff:ff:ff:ff:ff:ff
    inet 172.17.0.1/16 brd 172.17.255.255 scope global docker0
       valid_lft forever preferred_lft forever
    inet6 fe80::42:30ff:fe1c:4bae/64 scope link 
       valid_lft forever preferred_lft forever
8: kube-bridge: <BROADCAST,MULTICAST,UP,LOWER_UP> mtu 1500 qdisc noqueue state UP group default qlen 1000
    link/ether 0a:58:0a:50:60:41 brd ff:ff:ff:ff:ff:ff
    inet 10.80.96.65/29 scope global kube-bridge
       valid_lft forever preferred_lft forever
    inet6 fe80::9487:55ff:fe03:69a1/64 scope link 
       valid_lft forever preferred_lft forever
11: kube-dummy-if: <BROADCAST,NOARP,UP,LOWER_UP> mtu 1500 qdisc noqueue state UNKNOWN group default 
    link/ether f2:7d:88:7a:96:d3 brd ff:ff:ff:ff:ff:ff
    inet 10.96.0.1/32 brd 10.96.0.1 scope link kube-dummy-if
       valid_lft forever preferred_lft forever
    inet 10.96.0.10/32 brd 10.96.0.10 scope link kube-dummy-if
       valid_lft forever preferred_lft forever
    inet 10.105.217.13/32 brd 10.105.217.13 scope link kube-dummy-if
       valid_lft forever preferred_lft forever
    inet6 fe80::f07d:88ff:fe7a:96d3/64 scope link 
       valid_lft forever preferred_lft forever
12: vethde26d90b@if3: <BROADCAST,MULTICAST,UP,LOWER_UP> mtu 1500 qdisc noqueue master kube-bridge state UP group default 
    link/ether ba:f2:1e:a0:15:2f brd ff:ff:ff:ff:ff:ff link-netnsid 0
    inet6 fe80::b8f2:1eff:fea0:152f/64 scope link 
       valid_lft forever preferred_lft forever
13: veth7b135f01@if3: <BROADCAST,MULTICAST,UP,LOWER_UP> mtu 1500 qdisc noqueue master kube-bridge state UP group default 
    link/ether aa:20:29:d3:29:e2 brd ff:ff:ff:ff:ff:ff link-netnsid 1
    inet6 fe80::a820:29ff:fed3:29e2/64 scope link 
       valid_lft forever preferred_lft forever
14: veth1956ecdc@if3: <BROADCAST,MULTICAST,UP,LOWER_UP> mtu 1500 qdisc noqueue master kube-bridge state UP group default 
    link/ether 2a:d7:28:63:92:3e brd ff:ff:ff:ff:ff:ff link-netnsid 2
    inet6 fe80::28d7:28ff:fe63:923e/64 scope link 
       valid_lft forever preferred_lft forever
15: tunl0@NONE: <NOARP> mtu 1480 qdisc noop state DOWN group default qlen 1000
    link/ipip 0.0.0.0 brd 0.0.0.0
16: ipip0@NONE: <NOARP,UP,LOWER_UP> mtu 1480 qdisc noqueue state UNKNOWN group default qlen 1000
    link/ipip 0.0.0.0 brd 0.0.0.0
    inet 127.0.0.42/32 scope host ipip0
       valid_lft forever preferred_lft forever
18: veth9c036093@if4: <BROADCAST,MULTICAST,UP,LOWER_UP> mtu 1500 qdisc noqueue master kube-bridge state UP group default 
    link/ether fa:0a:06:f9:28:5e brd ff:ff:ff:ff:ff:ff link-netnsid 3
    inet6 fe80::f80a:6ff:fef9:285e/64 scope link 
       valid_lft forever preferred_lft forever
19: ip6tnl0@NONE: <NOARP> mtu 1452 qdisc noop state DOWN group default qlen 1000
    link/tunnel6 :: brd ::
20: ipip60@NONE: <NOARP,UP,LOWER_UP> mtu 1452 qdisc noqueue state UNKNOWN group default qlen 1000
    link/tunnel6 :: brd ::
    inet6 fe80::ac1a:bbff:fea6:2184/64 scope link 
       valid_lft forever preferred_lft forever

```

Every node has assigned subnet of ips that can sit there. In this case 10.80.96.64/29 through `kube-bridge`:
```
root@master:~# ip route
default via 147.x.x.x dev bond0 onlink 
10.0.0.0/8 via 10.80.96.0 dev bond0 
10.80.96.0/31 dev bond0 proto kernel scope link src 10.80.96.1 
10.80.96.64/29 dev kube-bridge proto kernel scope link src 10.80.96.65 
147.x.x.x/31 dev bond0 proto kernel scope link src 147.x.x.x
172.17.0.0/16 dev docker0 proto kernel scope link src 172.17.0.1 linkdown 
```

```
root@master:~# ./katran/katranc -l
2019/02/06 12:13:31 vips len 1
VIP:          10.80.96.13 Port:     80 Protocol: tcp
Vip's flags: 
 ->10.80.96.70       weight: 1
 ->10.80.96.68       weight: 1
exiting
```

tcpdump at master:
```
12:24:05.312977 IP 10.80.96.3.60764 > 10.80.96.13.http: Flags [S], seq 949265021, win 29200, options [mss 1460,sackOK,TS val 2208753565 ecr 0,nop,wscale 8], length 0
12:24:05.313047 IP 10.80.96.13.http > 10.80.96.3.60764: Flags [R.], seq 0, ack 949265022, win 0, length 0
```

```
root@test:~# curl 10.80.96.13:80
curl: (7) Failed to connect to 10.80.96.13 port 80: Connection refused
```

Reals 10.80.96.70:80, 10.80.96.68:80 could be accessed, it's a simple nginx.
```
root@test:~# curl 10.80.96.70
<!DOCTYPE html>
<html>
<head>
<title>Welcome to nginx!</title>
<style>
    body {
        width: 35em;
        margin: 0 auto;
        font-family: Tahoma, Verdana, Arial, sans-serif;
    }
</style>
</head>
<body>
<h1>Welcome to nginx!</h1>
<p>If you see this page, the nginx web server is successfully installed and
working. Further configuration is required.</p>

<p>For online documentation and support please refer to
<a href="http://nginx.org/">nginx.org</a>.<br/>
Commercial support is available at
<a href="http://nginx.com/">nginx.com</a>.</p>

<p><em>Thank you for using nginx.</em></p>
</body>
</html>
```
VIP 10.80.96.13/32 gets announced using BGP and is set at the interface lo. ipip tunnels are present and up.

Request on 10.80.96.13:80 returns connection refused, but tcpdump shows traffic got to the node.
I think it is caused by the fact I use bridge. Is it the case or do you see any other cause? Is there any way to mitigate this issue? @tehnerd 

```
root@master:~# ps faux | grep katran
root     23059  0.0  0.0  13108  1064 pts/5    S+   12:56   0:00          \_ grep --color=auto katran
root      3682  0.0  0.0  18376  2964 ?        Ss   12:13   0:00      |   \_ /bin/bash /katran/start_katran_grpc_server_smart.sh
root      3731  0.0  0.1 479676 11512 ?        SLl  12:13   0:00      |       \_ /katran/katran_server_grpc -balancer_prog /katran/balancer_kern.o -default_mac 54:1e:56:64:67:00 -forwarding_cores=0,1,2,3 -hc_forwarding=false -intf=bond0 -lru_size=10000
```
```
root@master:~# ip route | grep default
default via 147.x.x.x dev bond0 onlink 
root@master:~# ip n show | grep 147.x.x.x
147.x.x.x dev bond0 lladdr 54:1e:56:64:67:00 REACHABLE
```

```
root@master:~# ethtool -l enp0s20f0
Channel parameters for enp0s20f0:
Pre-set maximums:
RX:		0
TX:		0
Other:		1
Combined:	8
Current hardware settings:
RX:		0
TX:		0
Other:		1
Combined:	4

root@master:~# ethtool -l enp0s20f1
Channel parameters for enp0s20f1:
Pre-set maximums:
RX:		0
TX:		0
Other:		1
Combined:	8
Current hardware settings:
RX:		0
TX:		0
Other:		1
Combined:	4
```

**Comment by tehnerd** [comment]
could you please run tcpdump with -e flag (and also share they whole command which was used to collect it)  and also share "ip neighbor" output. the fact that you see traffic toward vip in tcpdump means that it "bypass" XDP (as xdp works before kernel's tcp/ip stack, if packet would be transmited back on the wire (w/ load balancer) it wont be seen in regular tcpdump). this could happens e.g. if packet from client enters this host from interface, other than bond0

**Comment by jprukner** [comment]
Thanks for the response. Oh, I see, tcpdump should not display anything.
I use packet.com on demand servers. So MACs are different than in the original comment because of "new" servers.
```
root@master:~# ip a
1: lo: <LOOPBACK,UP,LOWER_UP> mtu 65536 qdisc noqueue state UNKNOWN group default qlen 1000
    link/loopback 00:00:00:00:00:00 brd 00:00:00:00:00:00
    inet 127.0.0.1/8 scope host lo
       valid_lft forever preferred_lft forever
    inet 10.80.96.13/32 brd 10.80.96.13 scope global lo
       valid_lft forever preferred_lft forever
    inet6 ::1/128 scope host 
       valid_lft forever preferred_lft forever
2: enp0s20f0: <BROADCAST,MULTICAST,SLAVE,UP,LOWER_UP> mtu 1500 qdisc mq master bond0 state UP group default qlen 1000
    link/ether 0c:c4:7a:e5:45:86 brd ff:ff:ff:ff:ff:ff
3: enp0s20f1: <NO-CARRIER,BROADCAST,MULTICAST,SLAVE,UP> mtu 1500 qdisc mq master bond0 state DOWN group default qlen 1000
    link/ether 0c:c4:7a:e5:45:87 brd ff:ff:ff:ff:ff:ff
4: bond0: <BROADCAST,MULTICAST,MASTER,UP,LOWER_UP> mtu 1500 xdpgeneric/id:142 qdisc noqueue state UP group default qlen 1000
    link/ether 0c:c4:7a:e5:45:86 brd ff:ff:ff:ff:ff:ff
    inet 147.x.x.x/31 brd 255.255.255.255 scope global bond0
       valid_lft forever preferred_lft forever
    inet 10.80.96.1/31 brd 255.255.255.255 scope global bond0:0
       valid_lft forever preferred_lft forever
    inet6 2604:1380:2000:8f00::1/127 scope global 
       valid_lft forever preferred_lft forever
    inet6 fe80::ec4:7aff:fee5:4586/64 scope link 
       valid_lft forever preferred_lft forever
5: docker0: <NO-CARRIER,BROADCAST,MULTICAST,UP> mtu 1500 qdisc noqueue state DOWN group default 
    link/ether 02:42:cf:03:23:92 brd ff:ff:ff:ff:ff:ff
    inet 172.17.0.1/16 brd 172.17.255.255 scope global docker0
       valid_lft forever preferred_lft forever
    inet6 fe80::42:cfff:fe03:2392/64 scope link 
       valid_lft forever preferred_lft forever
8: kube-bridge: <BROADCAST,MULTICAST,UP,LOWER_UP> mtu 1500 qdisc noqueue state UP group default qlen 1000
    link/ether 0a:58:0a:50:60:41 brd ff:ff:ff:ff:ff:ff
    inet 10.80.96.65/29 scope global kube-bridge
       valid_lft forever preferred_lft forever
    inet6 fe80::6883:c4ff:fe8a:d22/64 scope link 
       valid_lft forever preferred_lft forever
12: kube-dummy-if: <BROADCAST,NOARP,UP,LOWER_UP> mtu 1500 qdisc noqueue state UNKNOWN group default 
    link/ether 96:3f:45:5a:07:51 brd ff:ff:ff:ff:ff:ff
    inet 10.96.0.1/32 brd 10.96.0.1 scope link kube-dummy-if
       valid_lft forever preferred_lft forever
    inet 10.96.0.10/32 brd 10.96.0.10 scope link kube-dummy-if
       valid_lft forever preferred_lft forever
    inet 10.100.49.67/32 brd 10.100.49.67 scope link kube-dummy-if
       valid_lft forever preferred_lft forever
    inet6 fe80::943f:45ff:fe5a:751/64 scope link 
       valid_lft forever preferred_lft forever
13: veth98785e9a@if3: <BROADCAST,MULTICAST,UP,LOWER_UP> mtu 1500 qdisc noqueue master kube-bridge state UP group default 
    link/ether 3e:49:85:6d:17:88 brd ff:ff:ff:ff:ff:ff link-netnsid 0
    inet6 fe80::3c49:85ff:fe6d:1788/64 scope link 
       valid_lft forever preferred_lft forever
14: veth94306543@if3: <BROADCAST,MULTICAST,UP,LOWER_UP> mtu 1500 qdisc noqueue master kube-bridge state UP group default 
    link/ether 6a:64:52:7d:51:1d brd ff:ff:ff:ff:ff:ff link-netnsid 1
    inet6 fe80::6864:52ff:fe7d:511d/64 scope link 
       valid_lft forever preferred_lft forever
15: veth09118628@if3: <BROADCAST,MULTICAST,UP,LOWER_UP> mtu 1500 qdisc noqueue master kube-bridge state UP group default 
    link/ether 4e:76:1f:5f:22:80 brd ff:ff:ff:ff:ff:ff link-netnsid 2
    inet6 fe80::4c76:1fff:fe5f:2280/64 scope link 
       valid_lft forever preferred_lft forever
16: tunl0@NONE: <NOARP> mtu 1480 qdisc noop state DOWN group default qlen 1000
    link/ipip 0.0.0.0 brd 0.0.0.0
17: ipip0@NONE: <NOARP,UP,LOWER_UP> mtu 1480 qdisc noqueue state UNKNOWN group default qlen 1000
    link/ipip 0.0.0.0 brd 0.0.0.0
    inet 127.0.0.42/32 scope host ipip0
       valid_lft forever preferred_lft forever
18: veth19de512c@if4: <BROADCAST,MULTICAST,UP,LOWER_UP> mtu 1500 qdisc noqueue master kube-bridge state UP group default 
    link/ether aa:1c:19:22:e8:48 brd ff:ff:ff:ff:ff:ff link-netnsid 3
    inet6 fe80::a81c:19ff:fe22:e848/64 scope link 
       valid_lft forever preferred_lft forever
```

```
root@master:~# ps faux | grep katran
root     12859  0.0  0.0  13108  1116 pts/0    S+   17:06   0:00          \_ grep --color=auto katran
root     12691  0.2  0.0  18376  2912 ?        Ss   17:06   0:00          \_ /bin/bash /katran/start_katran_grpc_server_smart.sh
root     12741  2.6  0.1 479676 11852 ?        SLl  17:06   0:00              \_ /katran/katran_server_grpc -balancer_prog /katran/balancer_kern.o -default_mac f4:cc:55:b3:ed:00 -forwarding_cores=0,1,2,3 -hc_forwarding=false -intf=bond0 -lru_size=10000
```

```
root@master:~# ip neighbor
10.80.96.66 dev kube-bridge lladdr 0a:58:0a:50:60:42 REACHABLE
10.80.96.0 dev bond0 lladdr f4:cc:55:b3:ed:00 REACHABLE
172.17.0.2 dev docker0 lladdr 02:42:ac:11:00:02 STALE
10.80.96.67 dev kube-bridge lladdr 0a:58:0a:50:60:43 REACHABLE
147.x.x.x dev bond0 lladdr f4:cc:55:b3:ed:00 REACHABLE
fe80::f6cc:550b:e6b3:ed00 dev bond0 lladdr f4:cc:55:b3:ed:00 router STALE
2604:1380:2000:8f00:: dev bond0 lladdr f4:cc:55:b3:ed:00 router STALE
```

```
root@master:~# ./katran/katranc -l
2019/02/06 17:42:51 vips len 1
VIP:          10.80.96.13 Port:     80 Protocol: tcp
Vip's flags: 
 ->10.80.96.69       weight: 1
 ->10.80.96.68       weight: 1
exiting
```
The output of tcpdump I posted in my initial comment was just `tcpdump -i bond0`. It was long, so I just picked that two lines. This is full tcpdump output with a filter to make it a bit shorter:
```
root@master:~# tcpdump -i bond0 -e 'not udp && not icmp && port not 22'
tcpdump: verbose output suppressed, use -v or -vv for full protocol decode
listening on bond0, link-type EN10MB (Ethernet), capture size 262144 bytes
17:45:13.248295 f4:cc:55:b3:ed:00 (oui Unknown) > 0c:c4:7a:e5:45:86 (oui Unknown), ethertype IPv4 (0x0800), length 60: 185.254.123.22.43410 > master.15973: Flags [S], seq 500237548, win 1024, length 0
17:45:13.248381 0c:c4:7a:e5:45:86 (oui Unknown) > f4:cc:55:b3:ed:00 (oui Unknown), ethertype IPv4 (0x0800), length 54: master.15973 > 185.254.123.22.43410: Flags [R.], seq 0, ack 500237549, win 0, length 0
17:45:13.311892 f4:cc:55:b3:ed:00 (oui Unknown) > 0c:c4:7a:e5:45:86 (oui Unknown), ethertype IPv4 (0x0800), length 60: 185.254.123.22.43410 > master.15973: Flags [R], seq 500237549, win 1200, length 0
17:45:15.713741 0c:c4:7a:e5:45:86 (oui Unknown) > f4:cc:55:b3:ed:00 (oui Unknown), ethertype IPv4 (0x0800), length 85: 10.80.96.1.59927 > 10.80.96.0.bgp: Flags [P.], seq 3858850785:3858850804, ack 110180691, win 115, options [nop,nop,TS val 1128522096 ecr 403272252], length 19: BGP
17:45:15.846788 f4:cc:55:b3:ed:00 (oui Unknown) > 0c:c4:7a:e5:45:86 (oui Unknown), ethertype IPv4 (0x0800), length 66: 10.80.96.0.bgp > 10.80.96.1.59927: Flags [.], ack 19, win 16384, options [nop,nop,TS val 403296385 ecr 1128522096], length 0
17:45:19.055896 f4:cc:55:b3:ed:00 (oui Unknown) > 0c:c4:7a:e5:45:86 (oui Unknown), ethertype IPv4 (0x0800), length 60: 185.254.123.22.43410 > master.10257: Flags [S], seq 3847782649, win 1024, length 0
17:45:19.055978 0c:c4:7a:e5:45:86 (oui Unknown) > f4:cc:55:b3:ed:00 (oui Unknown), ethertype IPv4 (0x0800), length 58: master.10257 > 185.254.123.22.43410: Flags [S.], seq 3197292589, ack 3847782650, win 29200, options [mss 1460], length 0
17:45:19.091793 f4:cc:55:b3:ed:00 (oui Unknown) > 0c:c4:7a:e5:45:86 (oui Unknown), ethertype IPv4 (0x0800), length 60: 185.254.123.22.43410 > master.10257: Flags [R], seq 3847782650, win 0, length 0
17:45:19.120461 f4:cc:55:b3:ed:00 (oui Unknown) > 0c:c4:7a:e5:45:86 (oui Unknown), ethertype IPv4 (0x0800), length 60: 185.254.123.22.43410 > master.10257: Flags [R], seq 3847782650, win 1200, length 0
17:45:19.217084 f4:cc:55:b3:ed:00 (oui Unknown) > 0c:c4:7a:e5:45:86 (oui Unknown), ethertype IPv4 (0x0800), length 85: 10.80.96.0.bgp > 10.80.96.1.59927: Flags [P.], seq 1:20, ack 19, win 16384, options [nop,nop,TS val 403299755 ecr 1128522096], length 19: BGP
17:45:19.217161 0c:c4:7a:e5:45:86 (oui Unknown) > f4:cc:55:b3:ed:00 (oui Unknown), ethertype IPv4 (0x0800), length 66: 10.80.96.1.59927 > 10.80.96.0.bgp: Flags [.], ack 20, win 115, options [nop,nop,TS val 1128525599 ecr 403299755], length 0
17:45:22.063918 f4:cc:55:b3:ed:00 (oui Unknown) > 0c:c4:7a:e5:45:86 (oui Unknown), ethertype IPv4 (0x0800), length 74: 10.80.96.3.60376 > 10.80.96.13.http: Flags [S], seq 2454828879, win 29200, options [mss 1460,sackOK,TS val 4213427658 ecr 0,nop,wscale 8], length 0
17:45:22.064022 0c:c4:7a:e5:45:86 (oui Unknown) > f4:cc:55:b3:ed:00 (oui Unknown), ethertype IPv4 (0x0800), length 54: 10.80.96.13.http > 10.80.96.3.60376: Flags [R.], seq 0, ack 2454828880, win 0, length 0
17:45:23.065551 f4:cc:55:b3:ed:00 (oui Unknown) > 0c:c4:7a:e5:45:86 (oui Unknown), ethertype IPv4 (0x0800), length 74: 10.80.96.3.60376 > 10.80.96.13.http: Flags [S], seq 2454828879, win 29200, options [mss 1460,sackOK,TS val 4213428662 ecr 0,nop,wscale 8], length 0
17:45:23.065649 0c:c4:7a:e5:45:86 (oui Unknown) > f4:cc:55:b3:ed:00 (oui Unknown), ethertype IPv4 (0x0800), length 54: 10.80.96.13.http > 10.80.96.3.60376: Flags [R.], seq 0, ack 1, win 0, length 0
17:45:23.111381 f4:cc:55:b3:ed:00 (oui Unknown) > 0c:c4:7a:e5:45:86 (oui Unknown), ethertype IPv4 (0x0800), length 60: 185.254.123.22.43410 > master.15759: Flags [S], seq 2399893606, win 1024, length 0
17:45:23.111467 0c:c4:7a:e5:45:86 (oui Unknown) > f4:cc:55:b3:ed:00 (oui Unknown), ethertype IPv4 (0x0800), length 54: master.15759 > 185.254.123.22.43410: Flags [R.], seq 0, ack 2399893607, win 0, length 0
17:45:23.161714 f4:cc:55:b3:ed:00 (oui Unknown) > 0c:c4:7a:e5:45:86 (oui Unknown), ethertype IPv4 (0x0800), length 60: 185.254.123.22.43410 > master.15759: Flags [R], seq 2399893607, win 1200, length 0
17:45:23.253385 f4:cc:55:b3:ed:00 (oui Unknown) > 0c:c4:7a:e5:45:86 (oui Unknown), ethertype IPv4 (0x0800), length 60: 185.254.123.22.43410 > master.18309: Flags [S], seq 2575811273, win 1024, length 0
17:45:23.253468 0c:c4:7a:e5:45:86 (oui Unknown) > f4:cc:55:b3:ed:00 (oui Unknown), ethertype IPv4 (0x0800), length 54: master.18309 > 185.254.123.22.43410: Flags [R.], seq 0, ack 2575811274, win 0, length 0
17:45:23.337545 f4:cc:55:b3:ed:00 (oui Unknown) > 0c:c4:7a:e5:45:86 (oui Unknown), ethertype IPv4 (0x0800), length 60: 185.254.123.22.43410 > master.18309: Flags [R], seq 2575811274, win 1200, length 0
17:45:23.609572 f4:cc:55:b3:ed:00 (oui Unknown) > 0c:c4:7a:e5:45:86 (oui Unknown), ethertype IPv4 (0x0800), length 60: client101.budaors.webhome.hu.37174 > master.telnet: Flags [S], seq 2471191857, win 44558, length 0
17:45:23.609664 0c:c4:7a:e5:45:86 (oui Unknown) > f4:cc:55:b3:ed:00 (oui Unknown), ethertype IPv4 (0x0800), length 54: master.telnet > client101.budaors.webhome.hu.37174: Flags [R.], seq 0, ack 2471191858, win 0, length 0
```

**Comment by jprukner** [comment]
Attaching also Katran's logs
```
root@master:~# kubectl logs loadbalancer-z9sz7 katran 
I0206 17:42:22.615610    16 KatranGrpcService.cpp:67] Starting Katran
E0206 17:42:22.616875    16 BpfLoader.cpp:166] Can't read section size for index: 2
I0206 17:42:22.616919    16 BpfLoader.cpp:448] Skipping section: 2 of file: /katran/balancer_kern.o
I0206 17:42:22.754390    16 BpfLoader.cpp:367] relocation for non existing prog w/ idx 10
I0206 17:42:22.754542    16 BpfLoader.cpp:367] relocation for non existing prog w/ idx 14
I0206 17:42:22.754657    16 BpfLoader.cpp:367] relocation for non existing prog w/ idx 16
I0206 17:42:22.754782    16 BpfLoader.cpp:367] relocation for non existing prog w/ idx 18
I0206 17:42:22.754870    16 BpfLoader.cpp:367] relocation for non existing prog w/ idx 20
E0206 17:42:22.783886    16 BpfLoader.cpp:103] Can't find map w/ name: lpm_src_v4
E0206 17:42:22.783938    16 BpfLoader.cpp:103] Can't find map w/ name: decap_dst
Server listening on 0.0.0.0:50052
I0206 17:42:23.165899    21 KatranLb.cpp:431] adding new vip: 10.80.96.13:80:6
```

**Comment by jprukner** [comment]
Hm, Since the issue seems to be xdp related, I should try to update kernel to see if this is not the root cause. If this does not help, I will try to disable bpf jit.

**Comment by tehnerd** [comment]
I don’t think that it is related to jit or kernel. Most likely to bond interface (as no one testing XDP on bond). Could you try to disable one interface in the bond and attach katran to second one physical interface (eg instead of bond0
Use something like eth0 directly. All
Other people who tried katran on bond were doing this. No one have tried bond0 directly)

**Comment by jprukner** [comment]
Ok, so I did `ifenslave -d bond0 enp0s20f1`, `ip link set enp0s20f1 down` and started Katran at `enp0s20f0`.

Now I get timeout:
```
root@test:~# curl 10.80.96.13:80
curl: (7) Failed to connect to 10.80.96.13 port 80: Connection timed out
```
However, ipip packets seems to arrive to master, that is good. So, ipip packet arrives and response is not sent? Has it something to do with `Request who-has 10.80.96.0 tell 10.80.96.1`?
I'd call myself (linux) networking beginner. Could you please help me further? @tehnerd 
```
root@master:~# tcpdump -i enp0s20f0 -e 'not udp && not icmp && port not 22'
tcpdump: verbose output suppressed, use -v or -vv for full protocol decode
listening on enp0s20f0, link-type EN10MB (Ethernet), capture size 262144 bytes
19:51:27.882206 0c:c4:7a:e5:45:86 (oui Unknown) > 0c:c4:7a:e5:45:86 (oui Unknown), ethertype Loopback (0x9000), length 60: Loopback, skipCount 0,  invalid (0)
19:51:28.042255 0c:c4:7a:10:73:96 (oui Unknown) > 01:80:c2:00:00:00 (oui Unknown), 802.3, length 39: LLC, dsap STP (0x42) Individual, ssap STP (0x42) Command, ctrl 0x03: STP 802.1w, Rapid STP, Flags [Learn, Forward], bridge-id 8000.0c:c4:7a:10:73:96.802e, length 43
19:51:28.926181 0c:c4:7a:e5:45:86 (oui Unknown) > 0c:c4:7a:e5:45:86 (oui Unknown), ethertype Loopback (0x9000), length 60: Loopback, skipCount 0,  invalid (0)
19:51:29.276779 f4:cc:55:b3:ed:00 (oui Unknown) > 0c:c4:7a:e5:45:86 (oui Unknown), ethertype IPv4 (0x0800), length 94: 172.16.156.232 > 10.80.96.68: 10.80.96.3.60412 > 10.80.96.13.http: Flags [S], seq 3130119047, win 29200, options [mss 1460,sackOK,TS val 4220995063 ecr 0,nop,wscale 8], length 0 (ipip-proto-4)
19:51:29.678179 0c:c4:7a:e5:45:86 (oui Unknown) > f4:cc:55:b3:ed:00 (oui Unknown), ethertype ARP (0x0806), length 42: Request who-has 10.80.96.0 tell 10.80.96.1, length 28
19:51:29.693641 f4:cc:55:b3:ed:00 (oui Unknown) > 0c:c4:7a:e5:45:86 (oui Unknown), ethertype ARP (0x0806), length 60: Reply 10.80.96.0 is-at f4:cc:55:b3:ed:00 (oui Unknown), length 46
19:51:29.931499 f4:cc:55:b3:ed:00 (oui Unknown) > 0c:c4:7a:e5:45:86 (oui Unknown), ethertype IPv4 (0x0800), length 85: 10.80.96.0.bgp > 10.80.96.1.48639: Flags [P.], seq 981137155:981137174, ack 779641324, win 16384, options [nop,nop,TS val 410858330 ecr 3753417487], length 19: BGP
19:51:29.931587 0c:c4:7a:e5:45:86 (oui Unknown) > f4:cc:55:b3:ed:00 (oui Unknown), ethertype IPv4 (0x0800), length 66: 10.80.96.1.48639 > 10.80.96.0.bgp: Flags [.], ack 19, win 115, options [nop,nop,TS val 3753422844 ecr 410858330], length 0
19:51:29.970174 0c:c4:7a:e5:45:86 (oui Unknown) > 0c:c4:7a:e5:45:86 (oui Unknown), ethertype Loopback (0x9000), length 60: Loopback, skipCount 0,  invalid (0)
19:51:30.042336 0c:c4:7a:10:73:96 (oui Unknown) > 01:80:c2:00:00:00 (oui Unknown), 802.3, length 39: LLC, dsap STP (0x42) Individual, ssap STP (0x42) Command, ctrl 0x03: STP 802.1w, Rapid STP, Flags [Learn, Forward], bridge-id 8000.0c:c4:7a:10:73:96.802e, length 43
19:51:30.284565 f4:cc:55:b3:ed:00 (oui Unknown) > 0c:c4:7a:e5:45:86 (oui Unknown), ethertype IPv4 (0x0800), length 94: 172.16.156.232 > 10.80.96.68: 10.80.96.3.60412 > 10.80.96.13.http: Flags [S], seq 3130119047, win 29200, options [mss 1460,sackOK,TS val 4220996071 ecr 0,nop,wscale 8], length 0 (ipip-proto-4)
19:51:31.022200 0c:c4:7a:e5:45:86 (oui Unknown) > 0c:c4:7a:e5:45:86 (oui Unknown), ethertype Loopback (0x9000), length 60: Loopback, skipCount 0,  invalid (0)
19:51:32.042455 0c:c4:7a:10:73:96 (oui Unknown) > 01:80:c2:00:00:00 (oui Unknown), 802.3, length 39: LLC, dsap STP (0x42) Individual, ssap STP (0x42) Command, ctrl 0x03: STP 802.1w, Rapid STP, Flags [Learn, Forward], bridge-id 8000.0c:c4:7a:10:73:96.802e, length 43
19:51:32.062150 0c:c4:7a:e5:45:86 (oui Unknown) > 0c:c4:7a:e5:45:86 (oui Unknown), ethertype Loopback (0x9000), length 60: Loopback, skipCount 0,  invalid (0)
19:51:32.300498 f4:cc:55:b3:ed:00 (oui Unknown) > 0c:c4:7a:e5:45:86 (oui Unknown), ethertype IPv4 (0x0800), length 94: 172.16.156.232 > 10.80.96.68: 10.80.96.3.60412 > 10.80.96.13.http: Flags [S], seq 3130119047, win 29200, options [mss 1460,sackOK,TS val 4220998087 ecr 0,nop,wscale 8], length 0 (ipip-proto-4)
19:51:33.102207 0c:c4:7a:e5:45:86 (oui Unknown) > 0c:c4:7a:e5:45:86 (oui Unknown), ethertype Loopback (0x9000), length 60: Loopback, skipCount 0,  invalid (0)
19:51:34.074146 0c:c4:7a:10:73:96 (oui Unknown) > 01:80:c2:00:00:00 (oui Unknown), 802.3, length 39: LLC, dsap STP (0x42) Individual, ssap STP (0x42) Command, ctrl 0x03: STP 802.1w, Rapid STP, Flags [Learn, Forward], bridge-id 8000.0c:c4:7a:10:73:96.802e, length 43
19:51:34.142162 0c:c4:7a:e5:45:86 (oui Unknown) > 0c:c4:7a:e5:45:86 (oui Unknown), ethertype Loopback (0x9000), length 60: Loopback, skipCount 0,  invalid (0)
19:51:35.190126 0c:c4:7a:e5:45:86 (oui Unknown) > 0c:c4:7a:e5:45:86 (oui Unknown), ethertype Loopback (0x9000), length 60: Loopback, skipCount 0,  invalid (0)
19:51:36.042850 0c:c4:7a:10:73:96 (oui Unknown) > 01:80:c2:00:00:00 (oui Unknown), 802.3, length 39: LLC, dsap STP (0x42) Individual, ssap STP (0x42) Command, ctrl 0x03: STP 802.1w, Rapid STP, Flags [Learn, Forward], bridge-id 8000.0c:c4:7a:10:73:96.802e, length 43
19:51:36.238140 0c:c4:7a:e5:45:86 (oui Unknown) > 0c:c4:7a:e5:45:86 (oui Unknown), ethertype Loopback (0x9000), length 60: Loopback, skipCount 0,  invalid (0)
19:51:36.364511 f4:cc:55:b3:ed:00 (oui Unknown) > 0c:c4:7a:e5:45:86 (oui Unknown), ethertype IPv4 (0x0800), length 94: 172.16.156.232 > 10.80.96.68: 10.80.96.3.60412 > 10.80.96.13.http: Flags [S], seq 3130119047, win 29200, options [mss 1460,sackOK,TS val 4221002151 ecr 0,nop,wscale 8], length 0 (ipip-proto-4)
19:51:37.027216 0c:c4:7a:10:73:96 (oui Unknown) > 01:80:c2:00:00:0e (oui Unknown), ethertype LLDP (0x88cc), length 120: LLDP, length 106: ONS
19:51:37.286187 0c:c4:7a:e5:45:86 (oui Unknown) > 0c:c4:7a:e5:45:86 (oui Unknown), ethertype Loopback (0x9000), length 60: Loopback, skipCount 0,  invalid (0)
19:51:38.043065 0c:c4:7a:10:73:96 (oui Unknown) > 01:80:c2:00:00:00 (oui Unknown), 802.3, length 39: LLC, dsap STP (0x42) Individual, ssap STP (0x42) Command, ctrl 0x03: STP 802.1w, Rapid STP, Flags [Learn, Forward], bridge-id 8000.0c:c4:7a:10:73:96.802e, length 43
19:51:38.326175 0c:c4:7a:e5:45:86 (oui Unknown) > 0c:c4:7a:e5:45:86 (oui Unknown), ethertype Loopback (0x9000), length 60: Loopback, skipCount 0,  invalid (0)
19:51:39.370182 0c:c4:7a:e5:45:86 (oui Unknown) > 0c:c4:7a:e5:45:86 (oui Unknown), ethertype Loopback (0x9000), length 60: Loopback, skipCount 0,  invalid (0)
19:51:40.043761 0c:c4:7a:10:73:96 (oui Unknown) > 01:80:c2:00:00:00 (oui Unknown), 802.3, length 39: LLC, dsap STP (0x42) Individual, ssap STP (0x42) Command, ctrl 0x03: STP 802.1w, Rapid STP, Flags [Learn, Forward], bridge-id 8000.0c:c4:7a:10:73:96.802e, length 43
19:51:40.426184 0c:c4:7a:e5:45:86 (oui Unknown) > 0c:c4:7a:e5:45:86 (oui Unknown), ethertype Loopback (0x9000), length 60: Loopback, skipCount 0,  invalid (0)
19:51:41.470170 0c:c4:7a:e5:45:86 (oui Unknown) > 0c:c4:7a:e5:45:86 (oui Unknown), ethertype Loopback (0x9000), length 60: Loopback, skipCount 0,  invalid (0)
19:51:42.043157 0c:c4:7a:10:73:96 (oui Unknown) > 01:80:c2:00:00:00 (oui Unknown), 802.3, length 39: LLC, dsap STP (0x42) Individual, ssap STP (0x42) Command, ctrl 0x03: STP 802.1w, Rapid STP, Flags [Learn, Forward], bridge-id 8000.0c:c4:7a:10:73:96.802e, length 43
19:51:42.518171 0c:c4:7a:e5:45:86 (oui Unknown) > 0c:c4:7a:e5:45:86 (oui Unknown), ethertype Loopback (0x9000), length 60: Loopback, skipCount 0,  invalid (0)
19:51:43.578153 0c:c4:7a:e5:45:86 (oui Unknown) > 0c:c4:7a:e5:45:86 (oui Unknown), ethertype Loopback (0x9000), length 60: Loopback, skipCount 0,  invalid (0)
19:51:44.043136 0c:c4:7a:10:73:96 (oui Unknown) > 01:80:c2:00:00:00 (oui Unknown), 802.3, length 39: LLC, dsap STP (0x42) Individual, ssap STP (0x42) Command, ctrl 0x03: STP 802.1w, Rapid STP, Flags [Learn, Forward], bridge-id 8000.0c:c4:7a:10:73:96.802e, length 43
19:51:44.556504 f4:cc:55:b3:ed:00 (oui Unknown) > 0c:c4:7a:e5:45:86 (oui Unknown), ethertype IPv4 (0x0800), length 94: 172.16.156.232 > 10.80.96.68: 10.80.96.3.60412 > 10.80.96.13.http: Flags [S], seq 3130119047, win 29200, options [mss 1460,sackOK,TS val 4221010343 ecr 0,nop,wscale 8], length 0 (ipip-proto-4)
19:51:44.618182 0c:c4:7a:e5:45:86 (oui Unknown) > 0c:c4:7a:e5:45:86 (oui Unknown), ethertype Loopback (0x9000), length 60: Loopback, skipCount 0,  invalid (0)
19:51:45.662216 0c:c4:7a:e5:45:86 (oui Unknown) > 0c:c4:7a:e5:45:86 (oui Unknown), ethertype Loopback (0x9000), length 60: Loopback, skipCount 0,  invalid (0)
19:51:46.043169 0c:c4:7a:10:73:96 (oui Unknown) > 01:80:c2:00:00:00 (oui Unknown), 802.3, length 39: LLC, dsap STP (0x42) Individual, ssap STP (0x42) Command, ctrl 0x03: STP 802.1w, Rapid STP, Flags [Learn, Forward], bridge-id 8000.0c:c4:7a:10:73:96.802e, length 43
19:51:46.706210 0c:c4:7a:e5:45:86 (oui Unknown) > 0c:c4:7a:e5:45:86 (oui Unknown), ethertype Loopback (0x9000), length 60: Loopback, skipCount 0,  invalid (0)
19:51:47.750183 0c:c4:7a:e5:45:86 (oui Unknown) > 0c:c4:7a:e5:45:86 (oui Unknown), ethertype Loopback (0x9000), length 60: Loopback, skipCount 0,  invalid (0)
19:51:48.043468 0c:c4:7a:10:73:96 (oui Unknown) > 01:80:c2:00:00:00 (oui Unknown), 802.3, length 39: LLC, dsap STP (0x42) Individual, ssap STP (0x42) Command, ctrl 0x03: STP 802.1w, Rapid STP, Flags [Learn, Forward], bridge-id 8000.0c:c4:7a:10:73:96.802e, length 43
19:51:48.790201 0c:c4:7a:e5:45:86 (oui Unknown) > 0c:c4:7a:e5:45:86 (oui Unknown), ethertype Loopback (0x9000), length 60: Loopback, skipCount 0,  invalid (0)
19:51:49.834214 0c:c4:7a:e5:45:86 (oui Unknown) > 0c:c4:7a:e5:45:86 (oui Unknown), ethertype Loopback (0x9000), length 60: Loopback, skipCount 0,  invalid (0)
19:51:50.043631 0c:c4:7a:10:73:96 (oui Unknown) > 01:80:c2:00:00:00 (oui Unknown), 802.3, length 39: LLC, dsap STP (0x42) Individual, ssap STP (0x42) Command, ctrl 0x03: STP 802.1w, Rapid STP, Flags [Learn, Forward], bridge-id 8000.0c:c4:7a:10:73:96.802e, length 43
19:51:50.878129 0c:c4:7a:e5:45:86 (oui Unknown) > 0c:c4:7a:e5:45:86 (oui Unknown), ethertype Loopback (0x9000), length 60: Loopback, skipCount 0,  invalid (0)
19:51:51.918242 0c:c4:7a:e5:45:86 (oui Unknown) > 0c:c4:7a:e5:45:86 (oui Unknown), ethertype Loopback (0x9000), length 60: Loopback, skipCount 0,  invalid (0)
19:51:52.043545 0c:c4:7a:10:73:96 (oui Unknown) > 01:80:c2:00:00:00 (oui Unknown), 802.3, length 39: LLC, dsap STP (0x42) Individual, ssap STP (0x42) Command, ctrl 0x03: STP 802.1w, Rapid STP, Flags [Learn, Forward], bridge-id 8000.0c:c4:7a:10:73:96.802e, length 43
19:51:52.970156 0c:c4:7a:e5:45:86 (oui Unknown) > 0c:c4:7a:e5:45:86 (oui Unknown), ethertype Loopback (0x9000), length 60: Loopback, skipCount 0,  invalid (0)
19:51:54.010149 0c:c4:7a:e5:45:86 (oui Unknown) > 0c:c4:7a:e5:45:86 (oui Unknown), ethertype Loopback (0x9000), length 60: Loopback, skipCount 0,  invalid (0)
19:51:54.043784 0c:c4:7a:10:73:96 (oui Unknown) > 01:80:c2:00:00:00 (oui Unknown), 802.3, length 39: LLC, dsap STP (0x42) Individual, ssap STP (0x42) Command, ctrl 0x03: STP 802.1w, Rapid STP, Flags [Learn, Forward], bridge-id 8000.0c:c4:7a:10:73:96.802e, length 43
19:51:54.574409 0c:c4:7a:e5:45:86 (oui Unknown) > f4:cc:55:b3:ed:00 (oui Unknown), ethertype IPv4 (0x0800), length 85: 10.80.96.1.48639 > 10.80.96.0.bgp: Flags [P.], seq 1:20, ack 19, win 115, options [nop,nop,TS val 3753447488 ecr 410858330], length 19: BGP
19:51:54.710043 f4:cc:55:b3:ed:00 (oui Unknown) > 0c:c4:7a:e5:45:86 (oui Unknown), ethertype IPv4 (0x0800), length 66: 10.80.96.0.bgp > 10.80.96.1.48639: Flags [.], ack 20, win 16384, options [nop,nop,TS val 410883069 ecr 3753447488], length 0
```

**Comment by tehnerd** [comment]
ok so we now see packets on the real side.
could you please share from real.
1) ip link show
2) ip route get 10.80.96.3
3) sysctl -a | grep rp_filter

most likely rp_filter is enabled and kernel droping packets after decapsulation because output from 2 shows that packets should be recved from, say, eth0 interface, but after decapsulation it is recved from ipip tunnel interface. setting rp_filter to 0 should fix this

**Comment by jprukner** [comment]
Here it is.
```
root@master:~# ip link show
1: lo: <LOOPBACK,UP,LOWER_UP> mtu 65536 qdisc noqueue state UNKNOWN mode DEFAULT group default qlen 1000
    link/loopback 00:00:00:00:00:00 brd 00:00:00:00:00:00
2: enp0s20f0: <BROADCAST,MULTICAST,SLAVE,UP,LOWER_UP> mtu 1500 xdpgeneric qdisc mq master bond0 state UP mode DEFAULT group default qlen 1000
    link/ether 0c:c4:7a:e5:45:86 brd ff:ff:ff:ff:ff:ff
    prog/xdp id 8 tag 0aa1937915f165e0 jited 
3: enp0s20f1: <NO-CARRIER,BROADCAST,MULTICAST,SLAVE,UP> mtu 1500 qdisc mq master bond0 state DOWN mode DEFAULT group default qlen 1000
    link/ether 0c:c4:7a:e5:45:87 brd ff:ff:ff:ff:ff:ff
4: bond0: <BROADCAST,MULTICAST,MASTER,UP,LOWER_UP> mtu 1500 qdisc noqueue state UP mode DEFAULT group default qlen 1000
    link/ether 0c:c4:7a:e5:45:86 brd ff:ff:ff:ff:ff:ff
5: docker0: <NO-CARRIER,BROADCAST,MULTICAST,UP> mtu 1500 qdisc noqueue state DOWN mode DEFAULT group default 
    link/ether 02:42:33:10:d0:ee brd ff:ff:ff:ff:ff:ff
6: kube-bridge: <BROADCAST,MULTICAST,UP,LOWER_UP> mtu 1500 qdisc noqueue state UP mode DEFAULT group default qlen 1000
    link/ether 0a:58:0a:50:60:41 brd ff:ff:ff:ff:ff:ff
7: veth16d6cb47@if3: <BROADCAST,MULTICAST,UP,LOWER_UP> mtu 1500 qdisc noqueue master kube-bridge state UP mode DEFAULT group default 
    link/ether 56:d7:b8:2c:2a:26 brd ff:ff:ff:ff:ff:ff link-netnsid 0
8: veth6c9b84fd@if3: <BROADCAST,MULTICAST,UP,LOWER_UP> mtu 1500 qdisc noqueue master kube-bridge state UP mode DEFAULT group default 
    link/ether 3e:63:8a:80:06:00 brd ff:ff:ff:ff:ff:ff link-netnsid 1
9: veth74dc54db@if3: <BROADCAST,MULTICAST,UP,LOWER_UP> mtu 1500 qdisc noqueue master kube-bridge state UP mode DEFAULT group default 
    link/ether 02:59:03:53:ae:e4 brd ff:ff:ff:ff:ff:ff link-netnsid 2
10: veth164cd54a@if3: <BROADCAST,MULTICAST,UP,LOWER_UP> mtu 1500 qdisc noqueue master kube-bridge state UP mode DEFAULT group default 
    link/ether 7a:91:c7:81:5f:35 brd ff:ff:ff:ff:ff:ff link-netnsid 3
11: kube-dummy-if: <BROADCAST,NOARP,UP,LOWER_UP> mtu 1500 qdisc noqueue state UNKNOWN mode DEFAULT group default 
    link/ether 42:9f:27:41:e4:e7 brd ff:ff:ff:ff:ff:ff
12: tunl0@NONE: <NOARP> mtu 1480 qdisc noop state DOWN mode DEFAULT group default qlen 1000
    link/ipip 0.0.0.0 brd 0.0.0.0
13: ipip0@NONE: <NOARP,UP,LOWER_UP> mtu 1480 qdisc noqueue state UNKNOWN mode DEFAULT group default qlen 1000
    link/ipip 0.0.0.0 brd 0.0.0.0
```
```
root@master:~# ip route get 10.80.96.3
10.80.96.3 via 10.80.96.0 dev bond0 src 10.80.96.1 uid 0 
    cache
```
```
root@master:~# sysctl -a | grep rp_filter
net.ipv4.conf.all.arp_filter = 0
net.ipv4.conf.all.rp_filter = 0
net.ipv4.conf.bond0.arp_filter = 0
net.ipv4.conf.bond0.rp_filter = 0
net.ipv4.conf.default.arp_filter = 0
net.ipv4.conf.default.rp_filter = 0
net.ipv4.conf.docker0.arp_filter = 0
net.ipv4.conf.docker0.rp_filter = 0
net.ipv4.conf.enp0s20f0.arp_filter = 0
net.ipv4.conf.enp0s20f0.rp_filter = 0
net.ipv4.conf.enp0s20f1.arp_filter = 0
net.ipv4.conf.enp0s20f1.rp_filter = 0
net.ipv4.conf.ipip0.arp_filter = 0
net.ipv4.conf.ipip0.rp_filter = 0
net.ipv4.conf.kube-bridge.arp_filter = 0
net.ipv4.conf.kube-bridge.rp_filter = 0
net.ipv4.conf.kube-dummy-if.arp_filter = 0
net.ipv4.conf.kube-dummy-if.rp_filter = 0
net.ipv4.conf.lo.arp_filter = 0
net.ipv4.conf.lo.rp_filter = 0
net.ipv4.conf.tunl0.arp_filter = 0
net.ipv4.conf.tunl0.rp_filter = 0
net.ipv4.conf.veth164cd54a.arp_filter = 0
net.ipv4.conf.veth164cd54a.rp_filter = 0
net.ipv4.conf.veth16d6cb47.arp_filter = 0
net.ipv4.conf.veth16d6cb47.rp_filter = 0
net.ipv4.conf.veth6c9b84fd.arp_filter = 0
net.ipv4.conf.veth6c9b84fd.rp_filter = 0
net.ipv4.conf.veth74dc54db.arp_filter = 0
net.ipv4.conf.veth74dc54db.rp_filter = 0
sysctl: reading key "net.ipv6.conf.all.stable_secret"
sysctl: reading key "net.ipv6.conf.bond0.stable_secret"
sysctl: reading key "net.ipv6.conf.default.stable_secret"
sysctl: reading key "net.ipv6.conf.docker0.stable_secret"
sysctl: reading key "net.ipv6.conf.enp0s20f0.stable_secret"
sysctl: reading key "net.ipv6.conf.enp0s20f1.stable_secret"
sysctl: reading key "net.ipv6.conf.ipip0.stable_secret"
sysctl: reading key "net.ipv6.conf.kube-bridge.stable_secret"
sysctl: reading key "net.ipv6.conf.kube-dummy-if.stable_secret"
sysctl: reading key "net.ipv6.conf.lo.stable_secret"
sysctl: reading key "net.ipv6.conf.veth164cd54a.stable_secret"
sysctl: reading key "net.ipv6.conf.veth16d6cb47.stable_secret"
sysctl: reading key "net.ipv6.conf.veth6c9b84fd.stable_secret"
sysctl: reading key "net.ipv6.conf.veth74dc54db.stable_secret"
```

**Comment by tehnerd** [comment]
could you please show output from
1. tcpdump -ni ipip0 -c 100 (when trying to curl)
2. also are there any iptables fw rules installed? could you share "iptables -vnL" mb ipip packets are being dropped by firewall

**Comment by jprukner** [comment]
There is no output for step 1. 

2.
```
Chain INPUT (policy ACCEPT 46512 packets, 9918K bytes)
 pkts bytes target     prot opt in     out     source               destination         
 1505 88750 KUBE-ROUTER-SERVICES  all  --  *      *       0.0.0.0/0            0.0.0.0/0            /* handle traffic to IPVS service IPs in custom chain */ match-set kube-router-service-ips dst
83527   24M KUBE-FIREWALL  all  --  *      *       0.0.0.0/0            0.0.0.0/0           

Chain FORWARD (policy DROP 0 packets, 0 bytes)
 pkts bytes target     prot opt in     out     source               destination         
  107  9716 ACCEPT     all  --  *      bond0   0.0.0.0/0            0.0.0.0/0            /* allow outbound node port traffic on node interface with which node ip is associated */
   27  2160 ACCEPT     all  --  *      kube-bridge  0.0.0.0/0            0.0.0.0/0            /* allow inbound traffic to pods */
    0     0 ACCEPT     all  --  kube-bridge *       0.0.0.0/0            0.0.0.0/0            /* allow outbound traffic from pods */
   18  1080 DOCKER-USER  all  --  *      *       0.0.0.0/0            0.0.0.0/0           
   18  1080 DOCKER-ISOLATION-STAGE-1  all  --  *      *       0.0.0.0/0            0.0.0.0/0           
    0     0 ACCEPT     all  --  *      docker0  0.0.0.0/0            0.0.0.0/0            ctstate RELATED,ESTABLISHED
    0     0 DOCKER     all  --  *      docker0  0.0.0.0/0            0.0.0.0/0           
    0     0 ACCEPT     all  --  docker0 !docker0  0.0.0.0/0            0.0.0.0/0           
    0     0 ACCEPT     all  --  docker0 docker0  0.0.0.0/0            0.0.0.0/0           

Chain OUTPUT (policy ACCEPT 47379 packets, 10M bytes)
 pkts bytes target     prot opt in     out     source               destination         
84870   25M KUBE-FIREWALL  all  --  *      *       0.0.0.0/0            0.0.0.0/0           

Chain DOCKER (1 references)
 pkts bytes target     prot opt in     out     source               destination         

Chain DOCKER-ISOLATION-STAGE-1 (1 references)
 pkts bytes target     prot opt in     out     source               destination         
    0     0 DOCKER-ISOLATION-STAGE-2  all  --  docker0 !docker0  0.0.0.0/0            0.0.0.0/0           
   18  1080 RETURN     all  --  *      *       0.0.0.0/0            0.0.0.0/0           

Chain DOCKER-ISOLATION-STAGE-2 (1 references)
 pkts bytes target     prot opt in     out     source               destination         
    0     0 DROP       all  --  *      docker0  0.0.0.0/0            0.0.0.0/0           
    0     0 RETURN     all  --  *      *       0.0.0.0/0            0.0.0.0/0           

Chain DOCKER-USER (1 references)
 pkts bytes target     prot opt in     out     source               destination         
   18  1080 RETURN     all  --  *      *       0.0.0.0/0            0.0.0.0/0           

Chain KUBE-FIREWALL (2 references)
 pkts bytes target     prot opt in     out     source               destination         
    0     0 DROP       all  --  *      *       0.0.0.0/0            0.0.0.0/0            /* kubernetes firewall for dropping marked packets */ mark match 0x8000/0x8000

Chain KUBE-ROUTER-SERVICES (1 references)
 pkts bytes target     prot opt in     out     source               destination         
  950 53422 ACCEPT     all  --  *      *       0.0.0.0/0            0.0.0.0/0            /* allow input traffic to ipvs services */ match-set kube-router-ipvs-services dst,dst
    0     0 ACCEPT     icmp --  *      *       0.0.0.0/0            0.0.0.0/0            /* allow icmp echo requests to service IPs */ icmptype 8
    0     0 REJECT     all  --  *      *       0.0.0.0/0            0.0.0.0/0            /* reject all unexpected traffic to service IPs */ ! match-set kube-router-local-ips dst reject-with icmp-port-unreachable
```

**Comment by tehnerd** [comment]
while i'm trying to figure out what else could be there, could you please run this command:
"ip link set up dev tunl0" and rerun your tests (w/ tcpdump enabled on tunl0 interface (-ni tunl0))

**Comment by jprukner** [comment]
should I set ip from 127.0.0.0/8 at tunl0 too?

**Comment by tehnerd** [comment]
yeah. e.g. 127.0.0.43/32

**Comment by jprukner** [comment]
```
...
12: tunl0@NONE: <NOARP,UP,LOWER_UP> mtu 1480 qdisc noqueue state UNKNOWN group default qlen 1000
    link/ipip 0.0.0.0 brd 0.0.0.0
    inet 127.0.0.43/32 scope host tunl0
       valid_lft forever preferred_lft forever
13: ipip0@NONE: <NOARP,UP,LOWER_UP> mtu 1480 qdisc noqueue state UNKNOWN group default qlen 1000
    link/ipip 0.0.0.0 brd 0.0.0.0
    inet 127.0.0.42/32 scope host ipip0
       valid_lft forever preferred_lft forever

root@master:~# tcpdump -ni tunl0
tcpdump: verbose output suppressed, use -v or -vv for full protocol decode
listening on tunl0, link-type RAW (Raw IP), capture size 262144 bytes

```
Still no output

**Comment by jprukner** [comment]
```
root@master:~# ipvsadm -Ln
IP Virtual Server version 1.2.1 (size=4096)
Prot LocalAddress:Port Scheduler Flags
  -> RemoteAddress:Port           Forward Weight ActiveConn InActConn
TCP  10.96.0.1:443 rr
  -> 10.80.96.1:6443              Masq    1      3          0         
TCP  10.96.0.10:53 rr
  -> 10.80.96.66:53               Masq    1      0          0         
  -> 10.80.96.69:53               Masq    1      0          0         
TCP  10.100.49.67:80 rr
  -> 10.80.96.67:80               Masq    1      0          0         
  -> 10.80.96.70:80               Masq    1      0          0         
UDP  10.96.0.10:53 rr
  -> 10.80.96.66:53               Masq    1      0          0         
  -> 10.80.96.69:53               Masq    1      0          0         
root@master:~# ./katran/katranc -l
2019/02/06 21:00:31 vips len 1
VIP:          10.80.96.13 Port:     80 Protocol: tcp
Vip's flags: 
 ->10.80.96.70       weight: 1
 ->10.80.96.67       weight: 1
exiting
```

**Comment by jprukner** [comment]
Could it be cause by ipvs?

**Comment by jprukner** [comment]
```
root@master:~# iptables -vnL -t nat
Chain PREROUTING (policy ACCEPT 2 packets, 80 bytes)
 pkts bytes target     prot opt in     out     source               destination         
  281 19238 DOCKER     all  --  *      *       0.0.0.0/0            0.0.0.0/0            ADDRTYPE match dst-type LOCAL

Chain INPUT (policy ACCEPT 2 packets, 80 bytes)
 pkts bytes target     prot opt in     out     source               destination         

Chain OUTPUT (policy ACCEPT 17 packets, 1020 bytes)
 pkts bytes target     prot opt in     out     source               destination         
 1144 68632 DOCKER     all  --  *      *       0.0.0.0/0           !127.0.0.0/8          ADDRTYPE match dst-type LOCAL

Chain POSTROUTING (policy ACCEPT 17 packets, 1020 bytes)
 pkts bytes target     prot opt in     out     source               destination         
 2654  163K KUBE-POSTROUTING  all  --  *      *       0.0.0.0/0            0.0.0.0/0            /* kubernetes postrouting rules */
    0     0 MASQUERADE  all  --  *      !docker0  172.17.0.0/16        0.0.0.0/0           
    4   240 MASQUERADE  all  --  *      *      !10.80.96.64/29      !10.80.96.64/29       vdir ORIGINAL vmethod MASQ /*  */

Chain DOCKER (2 references)
 pkts bytes target     prot opt in     out     source               destination         
    0     0 RETURN     all  --  docker0 *       0.0.0.0/0            0.0.0.0/0           

Chain KUBE-MARK-DROP (0 references)
 pkts bytes target     prot opt in     out     source               destination         
    0     0 MARK       all  --  *      *       0.0.0.0/0            0.0.0.0/0            MARK or 0x8000

Chain KUBE-MARK-MASQ (0 references)
 pkts bytes target     prot opt in     out     source               destination         
    0     0 MARK       all  --  *      *       0.0.0.0/0            0.0.0.0/0            MARK or 0x4000

Chain KUBE-POSTROUTING (1 references)
 pkts bytes target     prot opt in     out     source               destination         
    0     0 MASQUERADE  all  --  *      *       0.0.0.0/0            0.0.0.0/0            /* kubernetes service traffic requiring SNAT */ mark match 0x4000/0x4000
```
```
root@master:~# iptables -vnL -t raw
Chain PREROUTING (policy ACCEPT 0 packets, 0 bytes)
 pkts bytes target     prot opt in     out     source               destination         

Chain OUTPUT (policy ACCEPT 0 packets, 0 bytes)
 pkts bytes target     prot opt in     out     source               destination         
```
```
root@master:~# iptables -vnL -t mangle
Chain PREROUTING (policy ACCEPT 0 packets, 0 bytes)
 pkts bytes target     prot opt in     out     source               destination         

Chain INPUT (policy ACCEPT 0 packets, 0 bytes)
 pkts bytes target     prot opt in     out     source               destination         

Chain FORWARD (policy ACCEPT 0 packets, 0 bytes)
 pkts bytes target     prot opt in     out     source               destination         

Chain OUTPUT (policy ACCEPT 0 packets, 0 bytes)
 pkts bytes target     prot opt in     out     source               destination         

Chain POSTROUTING (policy ACCEPT 0 packets, 0 bytes)
 pkts bytes target     prot opt in     out     source               destination         

```

**Comment by jprukner** [comment]
It seems that clearing ipvs took down control plane I am building. Just a second.

**Comment by jprukner** [comment]
Whatever, katran stays up after control plane crashed anyway, so it does not matter. Either way, clearing ipvs did not help.

**Comment by tehnerd** [comment]
does "tcpdump -eni any dst 10.80.96.13 or src 10.80.96.3.60" showed anything?

**Comment by jprukner** [comment]
Nope
```
root@master:~# tcpdump -eni any dst 10.80.96.13 or src 10.80.96.3
tcpdump: verbose output suppressed, use -v or -vv for full protocol decode
listening on any, link-type LINUX_SLL (Linux cooked), capture size 262144 bytes
^C
0 packets captured
0 packets received by filter
0 packets dropped by kernel

```

**Comment by jprukner** [comment]
So the thing that `tcpdump -eni any dst 10.80.96.13 or src 10.80.96.3` shows nothing is a sign that packet is not decapsulated? Or it is decapsulated and then dropped? Just thinking aloud.

**Comment by tehnerd** [comment]
oh wait. from the output i was not able to find where  10.80.96.68 address is configured. could you show "ip route get  10.80.96.68" from the host from which you are doing tcpdump

**Comment by jprukner** [comment]
Well, I have to restart all set up time to time, because of one bug that I will hunt down after we solve this. This means there could be changes in IPs of reals this depends on what processes start first. Right now reals are 10.80.96.70, 10.80.96.67.
```
root@master:~# ip route get 10.80.96.68
10.80.96.68 dev kube-bridge src 10.80.96.65 uid 0 
    cache 
root@master:~# kubectl get pods -o wide
NAME                     READY   STATUS    RESTARTS   AGE     IP            NODE     NOMINATED NODE   READINESS GATES
loadbalancer-2664q       2/2     Running   1          22m     10.80.96.1    master   <none>           <none>
nginx-7cdbd8cdc9-bncvt   1/1     Running   2          4h49m   10.80.96.70   master   <none>           <none>
nginx-7cdbd8cdc9-rnlv4   1/1     Running   2          4h6m    10.80.96.67   master   <none>           <none>
root@master:~# katranc -l
2019/02/06 21:49:34 vips len 1
VIP:          10.80.96.13 Port:     80 Protocol: tcp
Vip's flags: 
 ->10.80.96.70       weight: 1
 ->10.80.96.67       weight: 1
exiting
```

**Comment by jprukner** [comment]
Does real have to be set at some interface? Like 10.80.96.70 is available through 10.80.96.65 at kube-bridge.

root@master:~# ip route 
default via 147.75.101.48 dev bond0 onlink 
10.0.0.0/8 via 10.80.96.0 dev bond0 
10.80.96.0/31 dev bond0 proto kernel scope link src 10.80.96.1 
**10.80.96.64/29 dev kube-bridge proto kernel scope link src 10.80.96.65** 
147.x.x.x/31 dev bond0 proto kernel scope link src 147.x.x.x
172.17.0.0/16 dev docker0 proto kernel scope link src 172.17.0.1 linkdown 

Every ip from 10.80.96.64/29 is set available through kube-bridge.  But addresses of reals are not set anywhere like 10.80.96.70/32 or 10.80.96.67/32. Is it the problem? Is it why the packet is dropped?

**Comment by tehnerd** [comment]
what i want is to somehow see where is ip address of the real is configured.
that host, where this ip address is configured, should have have ipip0 tunnel interface configured up and running. rp_filter should be disabled. 
the packet flow on this end host would looks like this
0. all network gear should know how to forward packets toward this host. that means, if there is any linux box along the way, it should have proper routing configured (knows where to send packet toward ip of the real) and sysctl net.ipv4.ip_forward set to 1
1. it receive packet from katran in format ipip. outer header would have 172.16.x.x as src and ip address of the real as dst. inner header would have src ip of the user, dst ip of the VIP.
2. this real server would decapsulated ipip (so tcpdump -ni ipip0 would show some traffic on ipip interface) and than send decapsulated packet to the localy configured vip.

all diagnostic above in last N messages was taken from the host, which have not had this ip address of the real configured (most likely in your config it is just acts as a routers along the path of the packet toward real's ip address. double check that it has ip_forward sysctl set to 1). thats why we have not seen any decapsulation/decapsulated packet on it's side.

so could you please show all the output which i have required above, from the host which has real's ip configured

**Comment by jprukner** [comment]
Right, so ip of real is set at veth interface that sits in different network namespace. That is why ip was not visible in outputs. The other from the veth pair is attached to bridge, in my case kube-bridge. Please see quote below.

```
root@master:~# ps faux | grep nginx
root     12409  0.0  0.0  14856  1116 pts/6    S+   22:46   0:00          \_ grep --color=auto nginx
root      4281  0.0  0.0  32652  4948 ?        Ss   20:27   0:00      |   \_ nginx: master process nginx -g daemon off;
systemd+  4334  0.0  0.0  33108  3000 ?        S    20:27   0:00      |       \_ nginx: worker process
```
```
root@master:~# nsenter -n -t 4281
root@master:~# ip a
1: lo: <LOOPBACK,UP,LOWER_UP> mtu 65536 qdisc noqueue state UNKNOWN group default qlen 1000
    link/loopback 00:00:00:00:00:00 brd 00:00:00:00:00:00
    inet 127.0.0.1/8 scope host lo
       valid_lft forever preferred_lft forever
3: eth0@if7: <BROADCAST,MULTICAST,UP,LOWER_UP> mtu 1500 qdisc noqueue state UP group default 
    link/ether 0a:58:0a:50:60:46 brd ff:ff:ff:ff:ff:ff link-netnsid 0
    inet 10.80.96.70/29 scope global eth0
       valid_lft forever preferred_lft forever
4: tunl0@NONE: <NOARP> mtu 1480 qdisc noop state DOWN group default qlen 1000
    link/ipip 0.0.0.0 brd 0.0.0.0
```

https://itnext.io/kubernetes-networking-behind-the-scenes-39a1ab1792bb
> A CNI plugin is responsible for inserting a network interface into the container network namespace (e.g. one end of a veth pair) and making any necessary changes on the host (e.g. attaching the other end of the veth into a bridge). It should then assign the IP to the interface and setup the routes consistent with the IP Address Management section by invoking appropriate IPAM plugin.

**Comment by jprukner** [comment]
```
root@master:~# nsenter -n -t 4281 -- ip a
1: lo: <LOOPBACK,UP,LOWER_UP> mtu 65536 qdisc noqueue state UNKNOWN group default qlen 1000
    link/loopback 00:00:00:00:00:00 brd 00:00:00:00:00:00
    inet 127.0.0.1/8 scope host lo
       valid_lft forever preferred_lft forever
3: eth0@if7: <BROADCAST,MULTICAST,UP,LOWER_UP> mtu 1500 qdisc noqueue state UP group default 
    link/ether 0a:58:0a:50:60:46 brd ff:ff:ff:ff:ff:ff link-netnsid 0
    inet 10.80.96.70/29 scope global eth0
       valid_lft forever preferred_lft forever
4: tunl0@NONE: <NOARP,UP,LOWER_UP> mtu 1480 qdisc noqueue state UNKNOWN group default qlen 1000
    link/ipip 0.0.0.0 brd 0.0.0.0
    inet 127.0.0.44/32 scope host tunl0
       valid_lft forever preferred_lft forever
```
```
root@master:~# nsenter -n -t 4281 -- tcpdump -eni any
tcpdump: verbose output suppressed, use -v or -vv for full protocol decode
listening on any, link-type LINUX_SLL (Linux cooked), capture size 262144 bytes
23:31:21.513814  In 0a:58:0a:50:60:41 ethertype IPv4 (0x0800), length 96: 172.16.180.228 > 10.80.96.70: 10.80.96.3.59348 > 10.80.96.13.80: Flags [S], seq 1676634983, win 29200, options [mss 1460,sackOK,TS val 4151869442 ecr 0,nop,wscale 8], length 0 (ipip-proto-4)
23:31:21.513835  In ethertype IPv4 (0x0800), length 76: 10.80.96.3.59348 > 10.80.96.13.80: Flags [S], seq 1676634983, win 29200, options [mss 1460,sackOK,TS val 4151869442 ecr 0,nop,wscale 8], length 0
23:31:21.513844 Out 0a:58:0a:50:60:46 ethertype IPv4 (0x0800), length 76: 10.80.96.3.59348 > 10.80.96.13.80: Flags [S], seq 1676634983, win 29200, options [mss 1460,sackOK,TS val 4151869442 ecr 0,nop,wscale 8], length 0
23:31:26.760955 Out 0a:58:0a:50:60:46 ethertype ARP (0x0806), length 44: Request who-has 10.80.96.65 tell 10.80.96.70, length 28
23:31:26.761008  In 0a:58:0a:50:60:41 ethertype ARP (0x0806), length 44: Reply 10.80.96.65 is-at 0a:58:0a:50:60:41, length 28
23:31:26.761080  In 0a:58:0a:50:60:41 ethertype ARP (0x0806), length 44: Request who-has 10.80.96.70 tell 10.80.96.65, length 28
23:31:26.761092 Out 0a:58:0a:50:60:46 ethertype ARP (0x0806), length 44: Reply 10.80.96.70 is-at 0a:58:0a:50:60:46, length 28
^C
7 packets captured
7 packets received by filter
0 packets dropped by kernel
```
I moved somewhere but still getting connection refused. It's well after midnight, I believe I'll figure it out tomorrow. Thank you for your guidance and help.

**Comment by tehnerd** [comment]
I’d recommend to start debugging from master node POV: eg can it see replies from contineiner on veth interface. Does it sent me out of bond0 etc

**Comment by jprukner** [comment]
Packets were not transmitted outside because VIP 10.80.96.13 was set at lo interface of the node master. I think that after response went out of kube-bridge it was sent to master's loopback interface. Removing VIP from loopback at the node master solved the issue.

```
root@master:~# ip a del 10.80.96.13/32 dev lo
```
```
root@test:~# curl 10.80.96.13
<!DOCTYPE html>
<html>
<head>
<title>Welcome to nginx!</title>
<style>
    body {
        width: 35em;
        margin: 0 auto;
        font-family: Tahoma, Verdana, Arial, sans-serif;
    }
</style>
</head>
<body>
<h1>Welcome to nginx!</h1>
<p>If you see this page, the nginx web server is successfully installed and
working. Further configuration is required.</p>

<p>For online documentation and support please refer to
<a href="http://nginx.org/">nginx.org</a>.<br/>
Commercial support is available at
<a href="http://nginx.com/">nginx.com</a>.</p>

<p><em>Thank you for using nginx.</em></p>
</body>
</html>
```
Thanks again, closing the issue now.
