### ISSUE TITLE
lru miss 100%

### ISSUE THREAD

**Issue by whj41** [facebookincubator/katran#14]
[katran machine(Ubuntu 18.04 kvm guest) info]
```
root@jockey-test:/home/ubuntu/katran/example_grpc# ethtool  -l eth0
Channel parameters for eth0:
Pre-set maximums:
RX:             0
TX:             0
Other:          0
Combined:       8
Current hardware settings:
RX:             0
TX:             0
Other:          0
Combined:       8
```

```
root@jockey-test:/home/ubuntu/katran# ./build/example_grpc/katran_server_grpc -balancer_prog ./deps/linux/bpfprog/bpf/balancer_kern.o  -default_mac fa:16:3e:6d:25:0b -healthchecker_prog ./deps/linux/bpfprog/bpf/healthchecking_ipip.o  -intf=eth0 -ipip_intf=ipip0 -ipip6_intf=ipip60 -lru_size=10000
I0821 11:33:39.125748  8470 KatranGrpcService.cpp:67] Starting Katran
E0821 11:33:39.125957  8470 BpfLoader.cpp:160] Can't read section size for index: 2
I0821 11:33:39.125982  8470 BpfLoader.cpp:434] Skipping section: 2 of file: ./deps/linux/bpfprog/bpf/balancer_kern.o
I0821 11:33:39.158964  8470 BpfLoader.cpp:353] relocation for non existing prog w/ idx 10
I0821 11:33:39.158993  8470 BpfLoader.cpp:353] relocation for non existing prog w/ idx 14
I0821 11:33:39.159008  8470 BpfLoader.cpp:353] relocation for non existing prog w/ idx 16
I0821 11:33:39.159010  8470 BpfLoader.cpp:353] relocation for non existing prog w/ idx 18
I0821 11:33:39.159013  8470 BpfLoader.cpp:353] relocation for non existing prog w/ idx 20
E0821 11:33:39.166762  8470 BpfLoader.cpp:160] Can't read section size for index: 2
I0821 11:33:39.166790  8470 BpfLoader.cpp:434] Skipping section: 2 of file: ./deps/linux/bpfprog/bpf/healthchecking_ipip.o
E0821 11:33:39.166806  8470 BpfLoader.cpp:160] Can't read section size for index: 12
I0821 11:33:39.166810  8470 BpfLoader.cpp:434] Skipping section: 12 of file: ./deps/linux/bpfprog/bpf/healthchecking_ipip.o
I0821 11:33:39.167026  8470 BpfLoader.cpp:353] relocation for non existing prog w/ idx 10
I0821 11:33:39.167047  8470 BpfLoader.cpp:353] relocation for non existing prog w/ idx 14
I0821 11:33:39.167052  8470 BpfLoader.cpp:353] relocation for non existing prog w/ idx 16
I0821 11:33:39.167070  8470 BpfLoader.cpp:353] relocation for non existing prog w/ idx 18
I0821 11:33:39.167073  8470 BpfLoader.cpp:353] relocation for non existing prog w/ idx 20
E0821 11:33:39.170778  8470 BpfLoader.cpp:97] Can't find name w/ name: lpm_src_v4
E0821 11:33:39.170791  8470 BpfLoader.cpp:97] Can't find name w/ name: decap_dst
Server listening on 0.0.0.0:50051
I0821 11:34:03.237671  8479 KatranLb.cpp:429] adding new vip: 10.200.200.1:22:6
I0821 11:36:18.393283  8487 KatranLb.cpp:429] adding new vip: 10.200.200.1:23:6
```
```
root@jockey-test:/home/ubuntu/katran/example_grpc# ./katran_goclient -l
2018/08/21 11:48:52 vips len 2
VIP:         10.200.200.1 Port:     23 Protocol: tcp
Vip's flags: 
 ->10.0.100.218      weight: 1
VIP:         10.200.200.1 Port:     22 Protocol: tcp
Vip's flags: 
 ->10.0.100.218      weight: 1
```

```
root@jockey-test:/home/ubuntu/katran/example_grpc# ip link show
1: lo: <LOOPBACK,UP,LOWER_UP> mtu 65536 qdisc noqueue state UNKNOWN mode DEFAULT group default qlen 1000
    link/loopback 00:00:00:00:00:00 brd 00:00:00:00:00:00
2: eth0: <BROADCAST,MULTICAST,UP,LOWER_UP> mtu 4076 xdp qdisc mq state UP mode DEFAULT group default qlen 1000
    link/ether fa:16:3e:0c:0f:46 brd ff:ff:ff:ff:ff:ff
    prog/xdp id 206548 tag 9ac36823edf016c9 jited 
3: br-87c747560664: <NO-CARRIER,BROADCAST,MULTICAST,UP> mtu 1500 qdisc noqueue state DOWN mode DEFAULT group default 
    link/ether 02:42:05:b4:52:71 brd ff:ff:ff:ff:ff:ff
4: docker0: <NO-CARRIER,BROADCAST,MULTICAST,UP> mtu 1500 qdisc noqueue state DOWN mode DEFAULT group default 
    link/ether 02:42:8b:17:c6:a4 brd ff:ff:ff:ff:ff:ff
17: tunl0@NONE: <NOARP> mtu 1480 qdisc noop state DOWN mode DEFAULT group default qlen 1000
    link/ipip 0.0.0.0 brd 0.0.0.0
18: ipip0@NONE: <NOARP,UP,LOWER_UP> mtu 1480 qdisc noqueue state UNKNOWN mode DEFAULT group default qlen 1000
    link/ipip 0.0.0.0 brd 0.0.0.0
19: ip6tnl0@NONE: <NOARP> mtu 1452 qdisc noop state DOWN mode DEFAULT group default qlen 1000
    link/tunnel6 :: brd ::
20: ipip60@NONE: <NOARP,UP,LOWER_UP> mtu 1452 qdisc noqueue state UNKNOWN mode DEFAULT group default qlen 1000
    link/tunnel6 :: brd ::
```

When client telnet to VIP 10.200.200.1 port 22,  katran_goclient prints "lru miss 100.00%" line.

```
root@jockey-test:/home/ubuntu/katran/example_grpc# ./katran_goclient -s -lru
summary: 21 pkts/sec. lru hit: 0.00% lru miss: 100.00% (tcp syn: 1.00% tcp non-syn: 0.00% udp: 0.00%) fallback lru hit: 21 pkts/sec
summary: 0 pkts/sec. lru hit: 0.00% lru miss: 0.00% (tcp syn: 0.00% tcp non-syn: 0.00% udp: 0.00%) fallback lru hit: 0 pkts/sec
summary: 0 pkts/sec. lru hit: 0.00% lru miss: 0.00% (tcp syn: 0.00% tcp non-syn: 0.00% udp: 0.00%) fallback lru hit: 0 pkts/sec
summary: 0 pkts/sec. lru hit: 0.00% lru miss: 0.00% (tcp syn: 0.00% tcp non-syn: 0.00% udp: 0.00%) fallback lru hit: 0 pkts/sec
summary: 0 pkts/sec. lru hit: 0.00% lru miss: 0.00% (tcp syn: 0.00% tcp non-syn: 0.00% udp: 0.00%) fallback lru hit: 0 pkts/sec
summary: 0 pkts/sec. lru hit: 0.00% lru miss: 0.00% (tcp syn: 0.00% tcp non-syn: 0.00% udp: 0.00%) fallback lru hit: 0 pkts/sec
summary: 0 pkts/sec. lru hit: 0.00% lru miss: 0.00% (tcp syn: 0.00% tcp non-syn: 0.00% udp: 0.00%) fallback lru hit: 0 pkts/sec
summary: 1 pkts/sec. lru hit: 0.00% lru miss: 100.00% (tcp syn: 1.00% tcp non-syn: 0.00% udp: 0.00%) fallback lru hit: 1 pkts/sec
summary: 1 pkts/sec. lru hit: 0.00% lru miss: 100.00% (tcp syn: 1.00% tcp non-syn: 0.00% udp: 0.00%) fallback lru hit: 1 pkts/sec
summary: 0 pkts/sec. lru hit: 0.00% lru miss: 0.00% (tcp syn: 0.00% tcp non-syn: 0.00% udp: 0.00%) fallback lru hit: 0 pkts/sec
```

**Comment by tehnerd** [comment]
are there any replies from telnet server? if not - 100% could be explained by the fact, that client is sending SYNs toward telnet server, but because there is no reply from server - it just keeping resend em. in katran, each SYN treated as "new connetion" and there is no LRU lookup for it, hence 100%. would be iterested to see how tcpdump on telnet server side looks like. could you please post output from "tcpdump -ni any host 10.200.200.1" running on telnet server side.

**Comment by whj41** [comment]
No tcpdump output on both katran and telnet server side.

I'm adding telnet server side info and tcpdump result:
```
root@jockey-u18:/home/ubuntu# ip addr
1: lo: <LOOPBACK,UP,LOWER_UP> mtu 65536 qdisc noqueue state UNKNOWN group default qlen 1000
    link/loopback 00:00:00:00:00:00 brd 00:00:00:00:00:00
    inet 127.0.0.1/8 scope host lo
       valid_lft forever preferred_lft forever
    inet 10.200.200.1/32 scope global lo
       valid_lft forever preferred_lft forever
    inet6 ::1/128 scope host 
       valid_lft forever preferred_lft forever
2: eth0: <BROADCAST,MULTICAST,UP,LOWER_UP> mtu 9000 qdisc fq_codel state UP group default qlen 1000
    link/ether fa:16:3e:88:cb:2d brd ff:ff:ff:ff:ff:ff
    inet 10.0.100.218/24 brd 10.0.100.255 scope global eth0
       valid_lft forever preferred_lft forever
    inet6 fe80::f816:3eff:fe88:cb2d/64 scope link 
       valid_lft forever preferred_lft forever
3: tunl0@NONE: <NOARP> mtu 1480 qdisc noop state DOWN group default qlen 1000
    link/ipip 0.0.0.0 brd 0.0.0.0
4: ipip0@NONE: <NOARP,UP,LOWER_UP> mtu 1480 qdisc noqueue state UNKNOWN group default qlen 1000
    link/ipip 0.0.0.0 brd 0.0.0.0
    inet 127.0.0.42/32 scope host ipip0
       valid_lft forever preferred_lft forever
```

tcpdump result
```
root@jockey-u18:/home/ubuntu# !tc
tcpdump -ni eth0 proto 4 or host 10.200.200.1
tcpdump: verbose output suppressed, use -v or -vv for full protocol decode
listening on eth0, link-type EN10MB (Ethernet), capture size 262144 bytes

```

**Comment by tehnerd** [comment]
What is acting as default router? Could you please show output from katran_server: 
1) ip route 
2) ip n show

**Comment by whj41** [comment]
[katran info]
```
root@jockey-test:/home/ubuntu/katran# ip route
default via 10.0.100.1 dev eth0 
10.0.100.0/24 dev eth0 proto kernel scope link src 10.0.100.215 
172.17.0.0/16 dev docker0 proto kernel scope link src 172.17.0.1 linkdown 
172.18.0.0/16 dev br-87c747560664 proto kernel scope link src 172.18.0.1 linkdown 


root@jockey-test:/home/ubuntu/katran# ip n show
10.0.100.216 dev eth0 lladdr fa:16:3e:6d:25:0b STALE
10.0.100.218 dev eth0 lladdr fa:16:3e:88:cb:2d STALE
10.0.100.30 dev eth0 lladdr fa:16:3e:b1:9f:1b STALE
10.0.100.1 dev eth0 lladdr fa:16:3e:2a:99:f4 REACHABLE
10.0.100.31 dev eth0 lladdr fa:16:3e:dc:07:cc STALE
```

[client info]
```
ubuntu@jockey-u:~$ ip route
default via 10.0.100.1 dev eth0 
10.0.100.0/24 dev eth0  proto kernel  scope link  src 10.0.100.216 
10.200.200.1 via 10.0.100.215 dev eth0 
169.254.169.254 via 10.0.100.1 dev eth0 
192.168.0.0/24 dev eth0  scope link 


ubuntu@jockey-u:~$ ip addr
1: lo: <LOOPBACK,UP,LOWER_UP> mtu 65536 qdisc noqueue state UNKNOWN group default 
    link/loopback 00:00:00:00:00:00 brd 00:00:00:00:00:00
    inet 127.0.0.1/8 scope host lo
       valid_lft forever preferred_lft forever
    inet6 ::1/128 scope host 
       valid_lft forever preferred_lft forever
2: eth0: <BROADCAST,MULTICAST,UP,LOWER_UP> mtu 9000 qdisc pfifo_fast state UP group default qlen 1000
    link/ether fa:16:3e:6d:25:0b brd ff:ff:ff:ff:ff:ff
    inet 10.0.100.216/24 brd 10.0.100.255 scope global eth0
       valid_lft forever preferred_lft forever
    inet6 fe80::f816:3eff:fe6d:250b/64 scope link 
       valid_lft forever preferred_lft forever
3: tunl0@NONE: <NOARP> mtu 1480 qdisc noop state DOWN group default 
    link/ipip 0.0.0.0 brd 0.0.0.0
4: ipip0@NONE: <POINTOPOINT,NOARP> mtu 8980 qdisc noqueue state DOWN group default 
    link/ipip 10.0.100.216 peer 10.0.100.215
```

[server info]
```
ubuntu@jockey-u18:~$ ip route
default via 10.0.100.1 dev eth0 
10.0.100.0/24 dev eth0 proto kernel scope link src 10.0.100.218 
169.254.169.254 via 10.0.100.1 dev eth0 
192.168.0.0/24 dev eth0 scope link 


ubuntu@jockey-u18:~$ ip addr
1: lo: <LOOPBACK,UP,LOWER_UP> mtu 65536 qdisc noqueue state UNKNOWN group default qlen 1000
    link/loopback 00:00:00:00:00:00 brd 00:00:00:00:00:00
    inet 127.0.0.1/8 scope host lo
       valid_lft forever preferred_lft forever
    inet 10.200.200.1/32 scope global lo
       valid_lft forever preferred_lft forever
    inet6 ::1/128 scope host 
       valid_lft forever preferred_lft forever
2: eth0: <BROADCAST,MULTICAST,UP,LOWER_UP> mtu 9000 qdisc fq_codel state UP group default qlen 1000
    link/ether fa:16:3e:88:cb:2d brd ff:ff:ff:ff:ff:ff
    inet 10.0.100.218/24 brd 10.0.100.255 scope global eth0
       valid_lft forever preferred_lft forever
    inet6 fe80::f816:3eff:fe88:cb2d/64 scope link 
       valid_lft forever preferred_lft forever
3: tunl0@NONE: <NOARP> mtu 1480 qdisc noop state DOWN group default qlen 1000
    link/ipip 0.0.0.0 brd 0.0.0.0
4: ipip0@NONE: <NOARP,UP,LOWER_UP> mtu 1480 qdisc noqueue state UNKNOWN group default qlen 1000
    link/ipip 0.0.0.0 brd 0.0.0.0
    inet 127.0.0.42/32 scope host ipip0
       valid_lft forever preferred_lft forever


ubuntu@jockey-u18:~$ ip link
1: lo: <LOOPBACK,UP,LOWER_UP> mtu 65536 qdisc noqueue state UNKNOWN mode DEFAULT group default qlen 1000
    link/loopback 00:00:00:00:00:00 brd 00:00:00:00:00:00
2: eth0: <BROADCAST,MULTICAST,UP,LOWER_UP> mtu 9000 qdisc fq_codel state UP mode DEFAULT group default qlen 1000
    link/ether fa:16:3e:88:cb:2d brd ff:ff:ff:ff:ff:ff
3: tunl0@NONE: <NOARP> mtu 1480 qdisc noop state DOWN mode DEFAULT group default qlen 1000
    link/ipip 0.0.0.0 brd 0.0.0.0
4: ipip0@NONE: <NOARP,UP,LOWER_UP> mtu 1480 qdisc noqueue state UNKNOWN mode DEFAULT group default qlen 1000
    link/ipip 0.0.0.0 brd 0.0.0.0

```

Client(10.0.100.216), katran(10.0.100.215) and server(10.0.100.218) share 10.0.100.0/24 subnet.

katran's default route is 10.0.100.1(mac fa:16:3e:2a:99:f4).

Since client routes VIP 10.200.200.1 directly to katran(10.0.100.215),
now I run katran_server_grpc with "-default_mac fa:16:3e:6d:25:0b" which is client's mac.
With -default_mac fa:16:3e:2a:99:f4 , result is same.

**Comment by tehnerd** [comment]
looking on your output from katran:
```
root@jockey-test:/home/ubuntu/katran# ip n show
10.0.100.216 dev eth0 lladdr fa:16:3e:6d:25:0b STALE
10.0.100.218 dev eth0 lladdr fa:16:3e:88:cb:2d STALE
10.0.100.30 dev eth0 lladdr fa:16:3e:b1:9f:1b STALE
10.0.100.1 dev eth0 lladdr fa:16:3e:2a:99:f4 REACHABLE
10.0.100.31 dev eth0 lladdr fa:16:3e:dc:07:cc STALE
```
and on your commands which were you using for running katran

```
./build/example_grpc/katran_server_grpc -balancer_prog ./deps/linux/bpfprog/bpf/balancer_kern.o  -default_mac fa:16:3e:6d:25:0b -healthchecker_prog ./deps/linux/bpfprog/bpf/healthchecking_ipip.o  -intf=eth0 -ipip_intf=ipip0 -ipip6_intf=ipip60 -lru_size=10000
```
mac address fa:16:3e:6d:25:0b

or 

```
 -default_mac fa:16:3e:2a:99:f4
```

the way katran works is that it receives packet, do encapsulation, and resend it to the server with specified mac. in production this mac usually is the mac of the default gateway (as in your 2nd try). however default gateway should be able to resend this packet to proper server. i'm not sure what is the default config for default gateway in VM environment.

first example/config is incorrect as katran were sending packets back to the client.

lets try (just to make sure that katran works as expected) to send all the packets to the server directly.
could you please retry w/ 

-default_mac fa:16:3e:88:cb:2d (mac address of .218)
and then take a tcpdump from the server w/ command
tcpdump -ni any proto 4. after that try to connect to the vip from the client and show the output of tcpdump

**Comment by whj41** [comment]
No tcpdump output at server.

[katran action]
```
root@jockey-test:/home/ubuntu/katran# ./build/example_grpc/katran_server_grpc -balancer_prog ./deps/linux/bpfprog/bpf/balancer_kern.o  -default_mac fa:16:3e:88:cb:2d -healthchecker_prog ./deps/linux/bpfprog/bpf/healthchecking_ipip.o  -intf=eth0 -ipip_intf=ipip0 -ipip6_intf=ipip60 -lru_size=10000
I0823 09:49:48.202528 20323 KatranGrpcService.cpp:67] Starting Katran
E0823 09:49:48.202709 20323 BpfLoader.cpp:160] Can't read section size for index: 2
I0823 09:49:48.202724 20323 BpfLoader.cpp:434] Skipping section: 2 of file: ./deps/linux/bpfprog/bpf/balancer_kern.o
I0823 09:49:48.237064 20323 BpfLoader.cpp:353] relocation for non existing prog w/ idx 10
I0823 09:49:48.237100 20323 BpfLoader.cpp:353] relocation for non existing prog w/ idx 14
I0823 09:49:48.237104 20323 BpfLoader.cpp:353] relocation for non existing prog w/ idx 16
I0823 09:49:48.237107 20323 BpfLoader.cpp:353] relocation for non existing prog w/ idx 18
I0823 09:49:48.237110 20323 BpfLoader.cpp:353] relocation for non existing prog w/ idx 20
E0823 09:49:48.244885 20323 BpfLoader.cpp:160] Can't read section size for index: 2
I0823 09:49:48.244907 20323 BpfLoader.cpp:434] Skipping section: 2 of file: ./deps/linux/bpfprog/bpf/healthchecking_ipip.o
E0823 09:49:48.244937 20323 BpfLoader.cpp:160] Can't read section size for index: 12
I0823 09:49:48.244943 20323 BpfLoader.cpp:434] Skipping section: 12 of file: ./deps/linux/bpfprog/bpf/healthchecking_ipip.o
I0823 09:49:48.245159 20323 BpfLoader.cpp:353] relocation for non existing prog w/ idx 10
I0823 09:49:48.245169 20323 BpfLoader.cpp:353] relocation for non existing prog w/ idx 14
I0823 09:49:48.245175 20323 BpfLoader.cpp:353] relocation for non existing prog w/ idx 16
I0823 09:49:48.245194 20323 BpfLoader.cpp:353] relocation for non existing prog w/ idx 18
I0823 09:49:48.245199 20323 BpfLoader.cpp:353] relocation for non existing prog w/ idx 20
E0823 09:49:48.249575 20323 BpfLoader.cpp:97] Can't find name w/ name: lpm_src_v4
E0823 09:49:48.249615 20323 BpfLoader.cpp:97] Can't find name w/ name: decap_dst
Server listening on 0.0.0.0:50051
I0823 09:50:17.464594 20330 KatranLb.cpp:429] adding new vip: 10.200.200.1:22:6
```

```
root@jockey-test:/home/ubuntu/katran/example_grpc# ./katran_goclient -l
2018/08/23 09:53:01 vips len 1
VIP:         10.200.200.1 Port:     22 Protocol: tcp
Vip's flags: 
 ->10.0.100.218      weight: 1
exiting
```

[tcpdump at server]
```
root@jockey-u18:/home/ubuntu# tcpdump -ni any proto 4 
tcpdump: verbose output suppressed, use -v or -vv for full protocol decode
listening on any, link-type LINUX_SLL (Linux cooked), capture size 262144 bytes
```

**Comment by whj41** [comment]
Also, RX/TX packet count is zero on katran ipip0 interface.

```
root@jockey-test:/home/ubuntu/katran/example_grpc# ifconfig ipip0
ipip0: flags=193<UP,RUNNING,NOARP>  mtu 1480
        inet 127.0.0.42  netmask 255.255.255.255
        tunnel   txqueuelen 1000  (IPIP Tunnel)
        RX packets 0  bytes 0 (0.0 B)
        RX errors 0  dropped 0  overruns 0  frame 0
        TX packets 0  bytes 0 (0.0 B)
        TX errors 0  dropped 0 overruns 0  carrier 0  collisions 0
```

**Comment by tehnerd** [comment]
katran doesn't use ipip0 for packet forwarding. only for healthchecking. so it expected to have 0 counters (as far as i can see you dont run healtchecks now). will try to replicate your topology here (as most likely there is some missconfiguration in environment). so few questions:
1) what are you using for VM (kvm/virtualbox/something else?)
2) could you please share (if host/hypervisor is linux) from hypervisor:
2.1) ip link show
2.2) brctl show
2.3) iptables -vnL
2.4) ebtables -vnL

**Comment by whj41** [comment]
openstack kvm.

[katran vm(Ubuntu 18.04) info on hypervisor] 

libvirt info
```
root@dtb-compute-03:~# virsh dumpxml instance-jockey8
...
    <interface type='bridge'>
      <mac address='fa:16:3e:0c:0f:46'/>
      <source bridge='qbrafe3775c-6c'/>
      <bandwidth>
        <inbound average='153600' peak='307200' burst='307200'/>
        <outbound average='153600' peak='307200' burst='307200'/>
      </bandwidth>
      <target dev='tapafe3775c-6c'/>
      <model type='virtio'/>
      <alias name='net0'/>
      <address type='pci' domain='0x0000' bus='0x00' slot='0x03' function='0x0'/>
      <driver name='vhost' queues='8'/>
    </interface>
...
```

qemu process
```
root@dtb-compute-03:~# ps aux | grep instance-jockey8
libvirt+  62023  9.1  9.4 12959308 6255688 ?    Sl   Aug21 368:02 qemu-system-x86_64 -enable-kvm -name instance-jockey8 -S -machine pc-i440fx-trusty,accel=kvm,usb=off -cpu SandyBridge,+invpcid,+erms,+bmi2,+smep,+avx2,+bmi1,+fsgsbase,+abm,+pdpe1gb,+rdrand,+f16c,+osxsave,+movbe,+dca,+pcid,+pdcm,+xtpr,+fma,+tm2,+est,+smx,+vmx,+ds_cpl,+monitor,+dtes64,+pbe,+tm,+ht,+ss,+acpi,+ds,+vme -m 8192 -realtime mlock=off -smp 4,sockets=4,cores=1,threads=1 -uuid 0235f88e-9516-4a26-a189-0d4dd6ed9bb2 -smbios type=1,manufacturer=OpenStack Foundation,product=OpenStack Nova,version=2015.1.1,serial=770c243e-3cf9-fb72-c264-ac1d5887fdf2,uuid=0235f88e-9516-4a26-a189-0d4dd6ed9bb2 -no-user-config -nodefaults -chardev socket,id=charmonitor,path=/var/lib/libvirt/qemu/instance-jockey.monitor,server,nowait -mon chardev=charmonitor,id=monitor,mode=control -rtc base=utc,driftfix=slew -global kvm-pit.lost_tick_policy=discard -no-hpet -no-shutdown -boot strict=on -device piix3-usb-uhci,id=usb,bus=pci.0,addr=0x1.0x2 -drive file=rbd:volumes/volume-76a0d53b-480a-4b11-a7af-f78108dde2ca:id=compute:key=AQD4ws9Y2FBREhAAHM2Zlp+jEStdNTksUd8VBA==:auth_supported=cephx\;none:mon_host=192.168.0.4\:6789\;192.168.0.7\:6789\;192.168.0.11\:6789,if=none,id=drive-virtio-disk0,format=raw,serial=76a0d53b-480a-4b11-a7af-f78108dde2ca,cache=writeback -device virtio-blk-pci,scsi=off,bus=pci.0,addr=0x4,drive=drive-virtio-disk0,id=virtio-disk0,bootindex=1
 -netdev tap,fds=40:48:55:56:57:58:59:60,id=hostnet0,vhost=on,vhostfds=61:62:63:64:65:66:67:68
 -device virtio-net-pci,mq=on,vectors=18,netdev=hostnet0,id=net0,mac=fa:16:3e:0c:0f:46,bus=pci.0,addr=0x3
 -chardev file,id=charserial0,path=/var/lib/nova/instances/20b7a382-10a9-43ce-b123-7e906d440e8d/console.log -device isa-serial,chardev=charserial0,id=serial0 -chardev pty,id=charserial1 -device isa-serial,chardev=charserial1,id=serial1 -device usb-tablet,id=input0 -vnc 0.0.0.0:10 -k en-us -device cirrus-vga,id=video0,bus=pci.0,addr=0x2 -device virtio-balloon-pci,id=balloon0,bus=pci.0,addr=0x5 -msg timestamp=on
```

bridge interface
```
root@dtb-compute-03:~# ip link show | grep qbrafe3775c-6c
564: qbrafe3775c-6c: <BROADCAST,MULTICAST,UP,LOWER_UP> mtu 65000 qdisc noqueue state UP mode DEFAULT group default 
566: qvbafe3775c-6c: <BROADCAST,MULTICAST,PROMISC,UP,LOWER_UP> mtu 65000 qdisc pfifo_fast master qbrafe3775c-6c state UP mode DEFAULT group default qlen 1000
634: tapafe3775c-6c: <BROADCAST,MULTICAST,UP,LOWER_UP> mtu 65000 qdisc htb master qbrafe3775c-6c state UNKNOWN mode DEFAULT group default qlen 500
```

tap interface
```
root@dtb-compute-03:~# iptables -vnL | grep tapafe3775c-6c
  14M 8355M neutron-openvswi-sg-chain  all  --  *      *       0.0.0.0/0            0.0.0.0/0            PHYSDEV match --physdev-out tapafe3775c-6c --physdev-is-bridged /* Direct traffic from the VM interface to the security group chain. */
  11M  697M neutron-openvswi-sg-chain  all  --  *      *       0.0.0.0/0            0.0.0.0/0            PHYSDEV match --physdev-in tapafe3775c-6c --physdev-is-bridged /* Direct traffic from the VM interface to the security group chain. */
    0     0 neutron-openvswi-oafe3775c-6  all  --  *      *       0.0.0.0/0            0.0.0.0/0            PHYSDEV match --physdev-in tapafe3775c-6c --physdev-is-bridged /* Direct incoming traffic from VM to the security group chain. */
  14M 8355M neutron-openvswi-iafe3775c-6  all  --  *      *       0.0.0.0/0            0.0.0.0/0            PHYSDEV match --physdev-out tapafe3775c-6c --physdev-is-bridged /* Jump to the VM specific chain. */
  11M  697M neutron-openvswi-oafe3775c-6  all  --  *      *       0.0.0.0/0            0.0.0.0/0            PHYSDEV match --physdev-in tapafe3775c-6c --physdev-is-bridged /* Jump to the VM specific chain. */
```

```
root@dtb-compute-03:~# iptables -vnL | grep tapafe3775c-6c
  14M 8355M neutron-openvswi-sg-chain  all  --  *      *       0.0.0.0/0            0.0.0.0/0            PHYSDEV match --physdev-out tapafe3775c-6c --physdev-is-bridged /* Direct traffic from the VM interface to the security group chain. */
  11M  697M neutron-openvswi-sg-chain  all  --  *      *       0.0.0.0/0            0.0.0.0/0            PHYSDEV match --physdev-in tapafe3775c-6c --physdev-is-bridged /* Direct traffic from the VM interface to the security group chain. */
    0     0 neutron-openvswi-oafe3775c-6  all  --  *      *       0.0.0.0/0            0.0.0.0/0            PHYSDEV match --physdev-in tapafe3775c-6c --physdev-is-bridged /* Direct incoming traffic from VM to the security group chain. */
  14M 8355M neutron-openvswi-iafe3775c-6  all  --  *      *       0.0.0.0/0            0.0.0.0/0            PHYSDEV match --physdev-out tapafe3775c-6c --physdev-is-bridged /* Jump to the VM specific chain. */
  11M  697M neutron-openvswi-oafe3775c-6  all  --  *      *       0.0.0.0/0            0.0.0.0/0            PHYSDEV match --physdev-in tapafe3775c-6c --physdev-is-bridged /* Jump to the VM specific chain. */
```

```
root@dtb-compute-03:~# brctl show
bridge name     bridge id               STP enabled     interfaces
br-aux          8000.6690178abbd1       no              bond1
                                                        p_e52381cd-0
br-ex           8000.a0369f83879a       no              bond0.100
                                                        p_ff798dba-0
br-fw-admin             8000.141877273810       no              eth4
br-mgmt         8000.a0369f83879a       no              bond0.101
br-storage              8000.a0369f83879a       no              bond0.102
qbr04834d7b-13          8000.8e9d7576e4b5       no              qvb04834d7b-13
                                                        tap04834d7b-13
qbr05773ca7-43          8000.1e201120c88b       no              qvb05773ca7-43
                                                        tap05773ca7-43
qbr0eeed1b2-c6          8000.3ed189a9330b       no              qvb0eeed1b2-c6
                                                        tap0eeed1b2-c6
qbr27de1d29-5d          8000.7ac990dd555e       no              qvb27de1d29-5d
                                                        tap27de1d29-5d
qbr4330db98-51          8000.42c531ef8f9c       no              qvb4330db98-51
                                                        tap4330db98-51
qbr44f24461-0f          8000.d25f342e3f18       no              qvb44f24461-0f
                                                        tap44f24461-0f
qbr4d3dce60-9a          8000.36602831a49d       no              qvb4d3dce60-9a
                                                        tap4d3dce60-9a
qbr5a063a30-56          8000.eecbb997cedd       no              qvb5a063a30-56
                                                        tap5a063a30-56
qbr5c66a39e-59          8000.d2f0446b0b94       no              qvb5c66a39e-59
                                                        tap5c66a39e-59
qbr5e2fe982-52          8000.0edee7289b77       no              qvb5e2fe982-52
                                                        tap5e2fe982-52
qbr78ddda8c-46          8000.22aaf73cacbf       no              qvb78ddda8c-46
                                                        tap78ddda8c-46
qbr7eb31a7e-9a          8000.4e62c8bbc148       no              qvb7eb31a7e-9a
                                                        tap7eb31a7e-9a
qbr804ba4d1-bc          8000.0ab2a37a9f03       no              qvb804ba4d1-bc
                                                        tap804ba4d1-bc
qbr880bff08-27          8000.ca0c94902b79       no              qvb880bff08-27
                                                        tap880bff08-27
qbr8973676d-60          8000.1adce96ed7a4       no              qvb8973676d-60
                                                        tap8973676d-60
qbr9b5a0238-4b          8000.3aac7ac303dd       no              qvb9b5a0238-4b
                                                        tap9b5a0238-4b
qbrafe3775c-6c          8000.42d30917e9c5       no              qvbafe3775c-6c
                                                        tapafe3775c-6c
qbrb4173812-83          8000.fe163e1c465d       no              qvbb4173812-83
                                                        tapb4173812-83
qbrc101fd4d-55          8000.26abe8929cdc       no              qvbc101fd4d-55
                                                        tapc101fd4d-55
qbrc103df85-9d          8000.da83b68bb978       no              qvbc103df85-9d
                                                        tapc103df85-9d
qbrc18e1ae4-5d          8000.3a1319e4318a       no              qvbc18e1ae4-5d
                                                        tapc18e1ae4-5d
qbrc39ac4af-1b          8000.dac2b08d2652       no              qvbc39ac4af-1b
                                                        tapc39ac4af-1b
qbrc5c1b559-b6          8000.fe163e51fef7       no              qvbc5c1b559-b6
                                                        tapc5c1b559-b6
qbrc80ccf4c-9b          8000.fe163e3d4a54       no              qvbc80ccf4c-9b
                                                        tapc80ccf4c-9b
qbrd3eb5afb-42          8000.e648726e1aaf       no              qvbd3eb5afb-42
                                                        tapd3eb5afb-42
qbrd45420c8-cb          8000.22c32d2dcb5a       no              qvbd45420c8-cb
                                                        tapd45420c8-cb
qbrda7b6a6e-6a          8000.32e3c123dac5       no              qvbda7b6a6e-6a
                                                        tapda7b6a6e-6a
qbre5cf831f-98          8000.c266affc9340       no              qvbe5cf831f-98
                                                        tape5cf831f-98
qbredb9db02-f5          8000.8eefa71bf679       no              qvbedb9db02-f5
                                                        tapedb9db02-f5
qbref5cc5a3-d2          8000.be4d271b85f9       no              qvbef5cc5a3-d2
                                                        tapef5cc5a3-d2
qbrf4b35d45-40          8000.d64a04edfc86       no              qvbf4b35d45-40
                                                        tapf4b35d45-40
qbrfd39b67b-23          8000.825136ca5c65       no              qvbfd39b67b-23
                                                        tapfd39b67b-23
```

**Comment by tehnerd** [comment]
could you please post all iptables rules (not just grep; as i can see from output that packets matched the itnerfac are redirected to some other rules (such as neutron-openvswi-sg-chain ; neutron-openvswi-oafe3775c-6 etc ) . most likely openstack are filtering packets from vm based on source ip address. but katran is using generated one for ipip encapsulation (so e.g. instead of  10.0.100.215 source of external ip header would be from 172.16.x.x/16 subnet (by default))

**Comment by whj41** [comment]
I'm adding full iptables rules.
[hypervisor-iptables.txt](https://github.com/facebookincubator/katran/files/2317772/hypervisor-iptables.txt)

Followings are tcpdump result for katran VM(10.0.100.215 mac fa:16:3e:0c:0f:46 ) before start katran_server_grpc.
```
root@jockey-test:/home/ubuntu# ifconfig eth0
eth0: flags=4163<UP,BROADCAST,RUNNING,MULTICAST>  mtu 4076
        inet 10.0.100.215  netmask 255.255.255.0  broadcast 10.0.100.255
        inet6 fe80::f816:3eff:fe0c:f46  prefixlen 64  scopeid 0x20<link>
        ether fa:16:3e:0c:0f:46  txqueuelen 1000  (Ethernet)
        RX packets 869570  bytes 73243595 (73.2 MB)
        RX errors 0  dropped 108  overruns 0  frame 108
        TX packets 866429  bytes 62292552 (62.2 MB)
        TX errors 0  dropped 0 overruns 0  carrier 0  collisions 0


root@jockey-test:/home/ubuntu# tcpdump -exi eth0 host 10.200.200.1
tcpdump: verbose output suppressed, use -v or -vv for full protocol decode
listening on eth0, link-type EN10MB (Ethernet), capture size 262144 bytes
09:27:00.374460 fa:16:3e:6d:25:0b (oui Unknown) > fa:16:3e:0c:0f:46 (oui Unknown), ethertype IPv4 (0x0800), length 74: 10.0.100.216.40785 > 10.200.200.1.ssh: Flags [S], seq 2603826265, win 26880, options [mss 8960,sackOK,TS val 368410182 ecr 0,nop,wscale 7], length 0
        0x0000:  4500 003c 421f 4000 4006 b6fb 0a00 64d8
        0x0010:  0ac8 c801 9f51 0016 9b33 3c59 0000 0000
        0x0020:  a002 6900 74e2 0000 0204 2300 0402 080a
        0x0030:  15f5 7e46 0000 0000 0103 0307
09:27:01.373428 fa:16:3e:6d:25:0b (oui Unknown) > fa:16:3e:0c:0f:46 (oui Unknown), ethertype IPv4 (0x0800), length 74: 10.0.100.216.40785 > 10.200.200.1.ssh: Flags [S], seq 2603826265, win 26880, options [mss 8960,sackOK,TS val 368410432 ecr 0,nop,wscale 7], length 0
        0x0000:  4500 003c 4220 4000 4006 b6fa 0a00 64d8
        0x0010:  0ac8 c801 9f51 0016 9b33 3c59 0000 0000
        0x0020:  a002 6900 73e8 0000 0204 2300 0402 080a
        0x0030:  15f5 7f40 0000 0000 0103 0307
09:27:03.377556 fa:16:3e:6d:25:0b (oui Unknown) > fa:16:3e:0c:0f:46 (oui Unknown), ethertype IPv4 (0x0800), length 74: 10.0.100.216.40785 > 10.200.200.1.ssh: Flags [S], seq 2603826265, win 26880, options [mss 8960,sackOK,TS val 368410933 ecr 0,nop,wscale 7], length 0
        0x0000:  4500 003c 4221 4000 4006 b6f9 0a00 64d8
        0x0010:  0ac8 c801 9f51 0016 9b33 3c59 0000 0000
        0x0020:  a002 6900 71f3 0000 0204 2300 0402 080a
        0x0030:  15f5 8135 0000 0000 0103 0307
```
It seems that packets to VIP(10.200.200.1) from client(10.0.100.216 mac fa:16:3e:6d:25:0b) are not blocked by openstack security group rules.

**Comment by tehnerd** [comment]
i'm thinking more about packet being blocked on reverse side (from katran to server). could you please try to run "tcpdump -ni any proto 4" on hypervisor while katran is running and packets are flowing there

**Comment by whj41** [comment]
[tcpdump on katran hypervisor]
```
root@dtb-compute-03:~# tcpdump -nli any proto 4
tcpdump: verbose output suppressed, use -v or -vv for full protocol decode
listening on any, link-type LINUX_SLL (Linux cooked), capture size 65535 bytes
04:40:44.864607 IP 172.16.236.71 > 10.0.100.218: IP 10.0.100.216.40840 > 10.200.200.1.22: Flags [S], seq 1401833565, win 26880, options [mss 8960,sackOK,TS val 428916300 ecr 0,nop,wscale 7], length 0 (ipip-proto-4)
04:40:44.864648 IP 172.16.236.71 > 10.0.100.218: IP 10.0.100.216.40840 > 10.200.200.1.22: Flags [S], seq 1401833565, win 26880, options [mss 8960,sackOK,TS val 428916300 ecr 0,nop,wscale 7], length 0 (ipip-proto-4)
04:40:44.864651 IP 172.16.236.71 > 10.0.100.218: IP 10.0.100.216.40840 > 10.200.200.1.22: Flags [S], seq 1401833565, win 26880, options [mss 8960,sackOK,TS val 428916300 ecr 0,nop,wscale 7], length 0 (ipip-proto-4)
04:40:44.864737 ethertype IPv4, IP 172.16.236.71 > 10.0.100.218: IP 10.0.100.216.40840 > 10.200.200.1.22: Flags [S], seq 1401833565, win 26880, options [mss 8960,sackOK,TS val 428916300 ecr 0,nop,wscale 7], length 0 (ipip-proto-4)
04:40:44.864769 ethertype IPv4, IP 172.16.236.71 > 10.0.100.218: IP 10.0.100.216.40840 > 10.200.200.1.22: Flags [S], seq 1401833565, win 26880, options [mss 8960,sackOK,TS val 428916300 ecr 0,nop,wscale 7], length 0 (ipip-proto-4)
04:40:44.864770 ethertype IPv4, IP 172.16.236.71 > 10.0.100.218: IP 10.0.100.216.40840 > 10.200.200.1.22: Flags [S], seq 1401833565, win 26880, options [mss 8960,sackOK,TS val 428916300 ecr 0,nop,wscale 7], length 0 (ipip-proto-4)
04:40:45.861207 IP 172.16.236.71 > 10.0.100.218: IP 10.0.100.216.40840 > 10.200.200.1.22: Flags [S], seq 1401833565, win 26880, options [mss 8960,sackOK,TS val 428916550 ecr 0,nop,wscale 7], length 0 (ipip-proto-4)
04:40:45.861235 IP 172.16.236.71 > 10.0.100.218: IP 10.0.100.216.40840 > 10.200.200.1.22: Flags [S], seq 1401833565, win 26880, options [mss 8960,sackOK,TS val 428916550 ecr 0,nop,wscale 7], length 0 (ipip-proto-4)
04:40:45.861237 IP 172.16.236.71 > 10.0.100.218: IP 10.0.100.216.40840 > 10.200.200.1.22: Flags [S], seq 1401833565, win 26880, options [mss 8960,sackOK,TS val 428916550 ecr 0,nop,wscale 7], length 0 (ipip-proto-4)
04:40:45.861237 ethertype IPv4, IP 172.16.236.71 > 10.0.100.218: IP 10.0.100.216.40840 > 10.200.200.1.22: Flags [S], seq 1401833565, win 26880, options [mss 8960,sackOK,TS val 428916550 ecr 0,nop,wscale 7], length 0 (ipip-proto-4)
04:40:45.861256 ethertype IPv4, IP 172.16.236.71 > 10.0.100.218: IP 10.0.100.216.40840 > 10.200.200.1.22: Flags [S], seq 1401833565, win 26880, options [mss 8960,sackOK,TS val 428916550 ecr 0,nop,wscale 7], length 0 (ipip-proto-4)
04:40:45.861257 ethertype IPv4, IP 172.16.236.71 > 10.0.100.218: IP 10.0.100.216.40840 > 10.200.200.1.22: Flags [S], seq 1401833565, win 26880, options [mss 8960,sackOK,TS val 428916550 ecr 0,nop,wscale 7], length 0 (ipip-proto-4)
```

**Comment by tehnerd** [comment]
for initial troubleshooting of hypervisor  i would recomend to configure katran in a way that it would resend all the packets to the real server directly (aka specify -default_mac fa:16:3e:88:cb:2d as a dst mac address (address of .218)) and then would make sure that this is the mac you see in tcpdumo (you can pass -e flag to tcpdump to see ethernet header)). by doing this you would troubleshoot L2 + firewall reachability between katran and real. in prod katran would resend all the packets to default gateway and it's default's gateway job to send em to proper real server. but not sure how default gateway is configured in VM env so would prefer to remove it from the picture during this initial troubleshooting phase

**Comment by whj41** [comment]
I've succeeded with -default_mac  fa:16:3e:88:cb:2d.
Thanks.

**Comment by tehnerd** [comment]
@whj41  let me know if you have any other questions regarding this.
