### ISSUE TITLE
TOS for ipv4 copy seems not working

### ISSUE THREAD

**Issue by tehnerd** [facebookincubator/katran#61]
w/ latest upstream diff:
```
commit 4f8508ca1cb363fce2b16a6ed3200d511f8f59ac (refs/remotes/upstream/master)
Author: Udip Pant <udippant@fb.com>
Date:   Wed Oct 9 09:21:16 2019 -0700

    add unit tests for feature to copy ToS value from inner packet
    
    Reviewed By: mjoras
    
    Differential Revision: D17826785
    
    fbshipit-source-id: 3eacfa8947a42f1aea9b0d1345d6b6d40ddcacec
```

running katran_tester:
```
./os_run_tester.sh 
+ '[' -z '' ']'
++ pwd
+ KATRAN_BUILD_DIR=/home/tehnerd/katran/_build/build
+ '[' -z '' ']'
++ pwd
+ DEPS_DIR=/home/tehnerd/katran/_build/deps
+ sudo sh -c '/home/tehnerd/katran/_build/build/katran/lib/testing/katran_tester -balancer_prog /home/tehnerd/katran/_build/deps/bpfprog/bpf/balancer_kern.o -test_from_fixtures=true '
libbpf: Error in bpf_create_map_xattr(lru_maps_mapping):ERROR: strerror_r(-524)=22(-524). Retrying without BTF.
E1009 18:34:46.199492 21152 BpfLoader.cpp:87] Can't find map w/ name: lpm_src_v4
E1009 18:34:46.199611 21152 BpfLoader.cpp:87] Can't find map w/ name: decap_dst
E1009 18:34:46.199625 21152 BpfLoader.cpp:87] Can't find map w/ name: event_pipe
E1009 18:34:46.199632 21152 BpfLoader.cpp:87] Can't find map w/ name: pckt_srcs
I1009 18:34:46.199656 21152 KatranLb.cpp:481] adding new vip: 10.200.1.1:80:17
I1009 18:34:46.274731 21152 KatranLb.cpp:481] adding new vip: 10.200.1.1:80:6
I1009 18:34:46.350360 21152 KatranLb.cpp:481] adding new vip: 10.200.1.2:0:6
I1009 18:34:46.418886 21152 KatranLb.cpp:481] adding new vip: 10.200.1.4:0:6
I1009 18:34:46.486299 21152 KatranLb.cpp:546] modyfing vip: 10.200.1.4:0:6
I1009 18:34:46.486353 21152 KatranLb.cpp:481] adding new vip: 10.200.1.3:80:6
I1009 18:34:46.553889 21152 KatranLb.cpp:481] adding new vip: fc00:1::1:80:6
I1009 18:34:46.620697 21152 KatranLb.cpp:481] adding new vip: 10.200.1.5:443:17
I1009 18:34:46.620771 21152 KatranLb.cpp:546] modyfing vip: 10.200.1.5:443:17
I1009 18:34:46.687752 21152 KatranLb.cpp:481] adding new vip: fc00:1::2:443:17
I1009 18:34:46.687876 21152 KatranLb.cpp:546] modyfing vip: fc00:1::2:443:17
I1009 18:34:46.755780 21152 XdpTester.cpp:168] Test: packet to UDP based v4 VIP (and v4 real)                     result: Passed
I1009 18:34:46.755833 21152 XdpTester.cpp:168] Test: packet to TCP based v4 VIP (and v4 real)                     result: Passed
I1009 18:34:46.755846 21152 XdpTester.cpp:168] Test: packet to TCP based v4 VIP (and v4 real) + ToS in IPV4       result: Passed
I1009 18:34:46.755856 21152 XdpTester.cpp:168] Test: packet to TCP based v4 VIP (and v4 real; any dst ports).     result: Passed
I1009 18:34:46.755867 21152 XdpTester.cpp:168] Test: packet to TCP based v4 VIP (and v6 real)                     result: Passed
I1009 18:34:46.755877 21152 XdpTester.cpp:168] Test: packet to TCP based v6 VIP (and v6 real)                     result: Passed
I1009 18:34:46.755887 21152 XdpTester.cpp:168] Test: packet to TCP based v6 VIP (and v6 real) with ToS / tc set   result: Passed
I1009 18:34:46.755895 21152 XdpTester.cpp:168] Test: v4 ICMP echo-request                                         result: Passed
I1009 18:34:46.755903 21152 XdpTester.cpp:168] Test: v6 ICMP echo-request                                         result: Passed
I1009 18:34:46.755913 21152 XdpTester.cpp:168] Test: v4 ICMP dest-unreachabe fragmentation-needed                 result: Passed
I1009 18:34:46.755923 21152 XdpTester.cpp:168] Test: v6 ICMP packet-too-big                                       result: Passed
I1009 18:34:46.755933 21152 XdpTester.cpp:168] Test: drop of IPv4 packet w/ options                               result: Passed
I1009 18:34:46.755940 21152 XdpTester.cpp:168] Test: drop of IPv4 fragmented packet                               result: Passed
I1009 18:34:46.755949 21152 XdpTester.cpp:168] Test: drop of IPv6 fragmented packet                               result: Passed
I1009 18:34:46.755957 21152 XdpTester.cpp:168] Test: pass of v4 packet with dst not equal to any configured VIP   result: Passed
I1009 18:34:46.755966 21152 XdpTester.cpp:168] Test: pass of v6 packet with dst not equal to any configured VIP   result: Passed
I1009 18:34:46.755975 21152 XdpTester.cpp:168] Test: pass of arp packet                                           result: Passed
I1009 18:34:46.755982 21152 XdpTester.cpp:168] Test: LRU hit                                                      result: Passed
I1009 18:34:46.755992 21152 XdpTester.cpp:168] Test: packet #1 dst port hashing only                              result: Passed
I1009 18:34:46.756001 21152 XdpTester.cpp:168] Test: packet #2 dst port hashing only                              result: Passed
I1009 18:34:46.756009 21152 XdpTester.cpp:168] Test: ipinip packet                                                result: Passed
I1009 18:34:46.756018 21152 XdpTester.cpp:168] Test: ipv6inipv6 packet                                            result: Passed
I1009 18:34:46.756027 21152 XdpTester.cpp:168] Test: ipv4inipv6 packet                                            result: Passed
I1009 18:34:46.756036 21152 XdpTester.cpp:168] Test: QUIC: long header. Client Initial type. LRU miss             result: Passed
I1009 18:34:46.756045 21152 XdpTester.cpp:168] Test: QUIC: long header. 0-RTT Protected. CH. LRU hit.             result: Passed
I1009 18:34:46.756054 21152 XdpTester.cpp:168] Test: QUIC: long header. Handshake. v4 vip v6 real. Conn Id based. result: Passed
I1009 18:34:46.756062 21152 XdpTester.cpp:168] Test: QUIC: long header. Retry. v4 vip v6 real. Conn Id based.     result: Passed
I1009 18:34:46.756072 21152 XdpTester.cpp:168] Test: QUIC: long header. client initial. v6 vip v6 real. LRU miss  result: Passed
I1009 18:34:46.756081 21152 XdpTester.cpp:168] Test: QUIC: short header. No connection id. CH. LRU hit            result: Passed
I1009 18:34:46.756089 21152 XdpTester.cpp:168] Test: QUIC: short header w/ connection id                          result: Passed
I1009 18:34:46.756098 21152 XdpTester.cpp:168] Test: QUIC: short header w/ connection id but non-existing mapping result: Passed
I1009 18:34:46.756106 21152 XdpTester.cpp:168] Test: QUIC: short header w/ conn id. host id = 0. CH. LRU hit      result: Passed
I1009 18:34:46.756217 21152 katran_tester.cpp:327] Testing counter's sanity. Printing on errors only
I1009 18:34:46.756355 21152 katran_tester.cpp:377] Testing of counters is complete
E1009 18:34:46.756445 21152 KatranSimulator.cpp:169] src and dst must have same address family
E1009 18:34:46.756454 21152 KatranSimulator.cpp:162] malformed src or dst ip address. src: aaaa dst: bbbb
```
aka everything is green/passed. however if i check what actual packets were generated (it is input/output format):
```
 ./os_run_tester.sh  -pcap_output=/tmp/test.pcap

18:35:45.391440 IP (tos 0x0, ttl 64, id 1, offset 0, flags [none], proto UDP (17), length 43)
    192.168.1.1.31337 > 10.200.1.1.80: [udp sum ok] UDP, length 15
18:35:45.391454 IP (tos 0x0, ttl 64, id 0, offset 0, flags [none], proto IPIP (4), length 63)
    172.16.104.123 > 10.0.0.3: IP (tos 0x0, ttl 64, id 1, offset 0, flags [none], proto UDP (17), length 43)
    192.168.1.1.31337 > 10.200.1.1.80: [udp sum ok] UDP, length 15
18:35:45.391502 IP (tos 0x0, ttl 64, id 1, offset 0, flags [none], proto TCP (6), length 55)
    192.168.1.1.31337 > 10.200.1.1.80: Flags [.], cksum 0x27e4 (correct), seq 0:15, ack 0, win 8192, length 15: HTTP
18:35:45.391510 IP (tos 0x0, ttl 64, id 0, offset 0, flags [none], proto IPIP (4), length 75)
    172.16.104.123 > 10.0.0.3: IP (tos 0x0, ttl 64, id 1, offset 0, flags [none], proto TCP (6), length 55)
    192.168.1.1.31337 > 10.200.1.1.80: Flags [.], cksum 0x27e4 (correct), seq 0:15, ack 1, win 8192, length 15: HTTP

bellow v4 input has tos output does not 
18:35:45.391521 IP (tos 0x8c, ttl 64, id 1, offset 0, flags [none], proto TCP (6), length 55)
    192.168.1.1.31337 > 10.200.1.1.80: Flags [.], cksum 0x27e4 (correct), seq 0:15, ack 1, win 8192, length 15: HTTP

no tos in output packet:
18:35:45.391525 IP (tos 0x0, ttl 64, id 0, offset 0, flags [none], proto IPIP (4), length 75)
    172.16.104.123 > 10.0.0.3: IP (tos 0x8c, ttl 64, id 1, offset 0, flags [none], proto TCP (6), length 55)
    192.168.1.1.31337 > 10.200.1.1.80: Flags [.], cksum 0x27e4 (correct), seq 0:15, ack 1, win 8192, length 15: HTTP


18:35:45.391533 IP (tos 0x0, ttl 64, id 1, offset 0, flags [none], proto TCP (6), length 55)
    192.168.1.1.31337 > 10.200.1.2.42: Flags [.], cksum 0x2809 (correct), seq 0:15, ack 0, win 8192, length 15
18:35:45.391537 IP (tos 0x0, ttl 64, id 0, offset 0, flags [none], proto IPIP (4), length 75)
    172.16.104.123 > 10.0.0.2: IP (tos 0x0, ttl 64, id 1, offset 0, flags [none], proto TCP (6), length 55)
    192.168.1.1.31337 > 10.200.1.2.42: Flags [.], cksum 0x2809 (correct), seq 0:15, ack 1, win 8192, length 15
18:35:45.391544 IP (tos 0x0, ttl 64, id 1, offset 0, flags [none], proto TCP (6), length 55)
    192.168.1.1.31337 > 10.200.1.3.80: Flags [.], cksum 0x27e2 (correct), seq 0:15, ack 0, win 8192, length 15: HTTP
18:35:45.391549 IP6 (hlim 64, next-header IPIP (4) payload length: 55) 100::bac1:101 > fc00::1: IP (tos 0x0, ttl 64, id 1, offset 0, flags [none], proto TCP (6), length 55)
    192.168.1.1.31337 > 10.200.1.3.80: Flags [.], cksum 0x27e2 (correct), seq 0:15, ack 1, win 8192, length 15: HTTP
18:35:45.391556 IP6 (hlim 64, next-header TCP (6) payload length: 35) fc00:2::1.31337 > fc00:1::1.80: Flags [.], cksum 0xfd4f (correct), seq 0:15, ack 0, win 8192, length 15: HTTP
18:35:45.391561 IP6 (hlim 64, next-header IPv6 (41) payload length: 75) 100::7a69:1 > fc00::3: IP6 (hlim 64, next-header TCP (6) payload length: 35) fc00:2::1.31337 > fc00:1::1.80: Flags [.], cksum 0xfd4f (correct), seq 0:15, ack 1, win 8192, length 15: HTTP
18:35:45.391570 IP6 (class 0x8c, hlim 64, next-header TCP (6) payload length: 35) fc00:2::1.31337 > fc00:1::1.80: Flags [.], cksum 0xfd4f (correct), seq 0:15, ack 1, win 8192, length 15: HTTP

v6 seems working as expected:
18:35:45.391574 IP6 (class 0x8c, hlim 64, next-header IPv6 (41) payload length: 75) 100::7a69:1 > fc00::3: IP6 (class 0x8c, hlim 64, next-header TCP (6) payload length: 35) fc00:2::1.31337 > fc00:1::1.80: Flags [.], cksum 0xfd4f (correct), seq 0:15, ack 1, win 8192, length 15: HTTP
```

the issue is that tos population is inside "decrement_ttl" stanza:
https://github.com/facebookincubator/katran/blob/master/katran/lib/bpf/balancer_kern.c#L230
which is set for true only for IPIP decapsulated packets when INLINE_DECAP is used (e.g. for stable anycast usecase)

**Comment by udippant** [comment]
Thanks for reporting this issue. Addressed in https://github.com/facebookincubator/katran/commit/8cb5beccd69eba49bbca0b8c9d855e7a48d0d5d2
